id,title,selftext,subreddit,created_utc,score,num_comments,upvote_ratio,author_flair,link_flair,has_media,label
1j639z5,Drawn to insecurities and psychological weakness like sharks?,"Okay it's weird but just hear me out.... I'm not boasting or flexing or anything I need to figure myself out.
You know how sharks can feel it when there's bl**d in the water? Like physically feel it- I can feel it when someone has insecurities...like not even talking about them- falling back onto their insecurities, thinking about them while saying something else, drawing from them, the way they phrase certain things, the way they keep repeating certain phrases- it's the small things. And it's not even just insecurities it's the psychological weakness. I can physically feel it-that's the best way to describe the rush- it's like being pulled towards them like sharks everytime they psychologically bleed(that's the best way I can put it).
Now I know every human is empathetic and we can all feel to certain extents but I'm pretty sure most people don't go around feeling it like I do. I'm pretty sure most people wouldn't be able to tell how deep someone's insecurities run after one text conversation and immediately go 'yes I want this one'. And yes I understand it's f*cked up but help me understand it",TrueOffMyChest,2025-03-07 23:18:42 UTC,1,2,1.0,,,0,0
1j638ou,"My dads in the icu, my boyfriends planning a trip","This happened in mid January. For context, I am 32F and my boyfriend is 34m, we've been together for 3 years and we live together in a house that I own. Now for the story- my dad has been unwell for over a month and my siblings and I (mom died from cancer when I was young) have been taking care of him while we waited for test results and some answers. Last week his condition took a turn for the worst and he ended up being taken to the hospital by ambulance and has been in the icu for a week. He was diagnosed with cancer. We still don't have all the answers and I don't know what the future holds for my family. On the third day that my dad was in the icu, my boyfriend was at work and texted me about his plans for the following day that consisted of him meeting up with friends to ""plan their trip."" I knew they had been talking loosely talking about potentially going on a trip at the end of the month, but I thought it was common sense that since my dad is in the hospital, the trip would be off. Well apparently not. Needless to say, we had an argument. I told him it's extremely hurtful that he would abandon me at a time like this.
After a lot of back and forth throughout the day he let me know the trip was cancelled (nothing had been paid for or even booked yet), but at this point I just feel like the damage is done. Who would prioritize a ""boys trip"" when their partners only parent is extremely sick in the hospital. The obvious answer is to break up, but I don't know if I have it in me to go through a breakup right now. It's been a few days now, my dad is doing much better, he's out of the icu and I've been there everyday helping him with his recovery so he can come home. I've been off work for the past week and a half during all this and went back yesterday and have been going to the hospital between shifts. My boyfriend has been moping around the house the last few days and every time I ask him what's wrong he says ""nothing"" or ""I don't know, I'm just sad."" I said if this is about the trip, then just go. He says that's not what it's about. I suggested he goes to talk to someone , a therapist or a friend.. or me. He declined all of this. I asked what I can do to help, he said nothing and ""I'm not his therapist"" I said nothing and just collected my stuff and went to work. I have a lot on my plate already, and I'm feeling angry that he's putting this on me now as well. We spent the next few days avoiding eachother around the house which was making my mental health seriously depleted. We finally had a conversation, I told him he should go on the trip because there's no sense of him staying here if he's not even going to acknowledge me or be supportive to me and my family anyways. The next day, he booked his flight. I tried to convince myself I was okay with it, but his 5 day trip suddenly turned into 10 days, and I just knew I was done. We had a few conversations while he was away, mostly me crying and telling him how angry I am with him. He came home, and I ended it as soon as he walked in the door. He begged and pleaded, said he ""never would have left"" if he knew I would end it because of the trip. There was a lot of back and forth and I asked him if he could just leave for a few days to give me some space, which he did. He ended up taking me on a date for Valentine's Day later that week and things seemed to be getting a little bit better. We planned a night away the following week to try to connect again. During our ""romantic night away"" he decided it was a good idea to invite his friend and friends girlfriend to join us for dinner (the girlfriend ended up not coming so it was just me, my bf and his friend) .. and then ""surprisingly"" a bunch of his other work friends just happened to be at the same restaurant. What was supposed to be a romantic evening to try to repair our relationship ended up being a table of 8 of us, talking about my boyfriends job. We went back to the hotel, got into an argument and went to bed angry. The next day we woke up and he got in the shower and left his Apple Watch on the night stand. I had that gut instinct to check his messages, and there it was. He was been messaging with another girl the entire time my dad was in the hospital and was meeting up with her for ""coffee dates "" . Which I highly doubt is all that happened. So ya, that's it. He moved his stuff out last week , and the person I thought I knew for the last almost 4 years has become the person whose hurt me more than anyone ever has in my life. I'm on my own again, going to be 33 next month, and starting from scratch. I don't know what the future holds but it has to be better than this, right?",TrueOffMyChest,2025-03-07 23:17:01 UTC,10,1,0.78,,,0,0
1j62wut,"nex fiance ruined my life, blamed me for it, and then admitted he was never capable of it","just saw a post about their narc maybe being DL and i'm realizing mine definitely was, and after everything he did and blaming me for it he said that's why he did it and couldn't have let us every happen or get married bc of his hidden desires. (exact quote at the bottom) in the beginning, he said he had a deep fetish, he said it was humiliation at first. then the real truth was later revealed to me. and then it wasn't until after the break up he said there was sissy and cross dressing and that he might be gay. which is so bizarre bc one he only ever told me about the real kink way later and never told me the full details of it and he loves women sexually and is very sexual and addicted to porn. but he was interested in trans women and anal sex i guess.
it's wild bc he always said he could never be in a relationship with a man bc he needed a woman who was submissive and he had control over basically. he wanted a woman in her feminine energy but wasn't safe enough to let me stay there. after our break up also, he went on a power kick after i was trying to say goodbye like i guess trying to regain power and he was being agressive and telling me to submit and basically confirm that he was right and i was wrong and legit got hard from it. the next day i said ""i will only submit to a man who protects and takes care of me and does not abuse me"" and he said he would still abuse me and i should stop ""whinning"" about it.
there were times he wanted to have sex with me while watching porn and wouldn't show what the porn was, or giving him bjs and hjs while he watched porn.
i've posted my story lots but have left out this major detail bc it felt wrong to discuss but for reference, we got engaged, i uprooted my life to go move in with him in another state. 6 days after the proposal and me thousands of dollars deep into the move, he called it off unprovoked (bc by this time i had been ""perfect"" according to his unreasonable standards) but he still blamed me. this is all after months of emotional and verbal abuse. i lost my home, a job, a baby, mental health, love, my best friend, my safety
the realization is:
- he legit told me he loved his fetish and addictions more than me. and he also said after he broke off our engagement and putting me through absolute hell and destroying my life and financially abusing me and me loosing my home to go move with him after our engagement, AFTER blaming me for the reason why he did it and a couple weeks after i came back to my state and was recovering from the move.
he said ""So we get married have kids And I say by the way I love wearing diapers. Dressing as a girl and letting dudes or someone fuck my ass? I wasn't gonna let that happen"" and that he wasn't sure if he was bi or gay.
i couldn't tell if he was saying all of that as a ploy to make it ""easier"" to be friends with him, bc he was actively saying he wanted me in his life and he said would it be easier if i were gay and then told me all those things. idk if it was more manipulation or if it's true. i know his kink is a major thing and it wasn't something i was into and he wants to be with someone romantically who isn't into in but still have sexual encounters with people who are into his kink. i can never tell when he was being honest or just saying something to get a certain reaction out of me. there were several times he'd say ""im going to go fuck this girl tonight bc you stress me out"" and then i'd find out he was home along and not with her. his mom would tell me or he later would tell me he never did. there were plenty of cases like this too. he would just say things to make me believe it. so i couldn't tell if he was saying he might be gay for that instance too. idk.
in no way am i being insensitive to sexuality or kinks. i was very supportive to him through it all but this is just making me realize he was never going to follow through and legit used me.
he basically admitted to putting me through hell, abusing me very thoroughly, blaming it allllll on me and my character flaws, made me lose my home to move states with him, tell me entire family we got engaged, lose my job, and spend thousands on moving, lose a child, all to cancel our engagement and move during a mania spike he had and BLAMES IT ON ME, all while he was literally never going to be capable of following through.
there were so many signs too im realizing now that i've missed. he used to straight up tell me that he was mirroring me and i thought that was weird bc women typically mirror the man. he used to also say he'd just find someone to marry him out of convenience bc he wasn't capable of love. he was always so selfish in every aspect of our lives. he always made it known to everyone and called me his wife and loved the image that it gave him but treated me like dirt. this man was straight up telling me he was a narcissist and i missed the signs in a haze.
he emotionally, verbally, mentally and financially abused me for literally nothing. bc i was kind and sweet and supportive and empathetic and showed him love he couldn't even fathom. he literally watched me as i bent over backwards for him and took care of him and lost the stability in my life to create one with him while he was just belittling me and destroying my worth and esteem. he needed control over me bc he lacked it in his own life and addictions and self. and was never going to marry me or create the life together we planned bc his demons and desires would have never allowed it even when i was accommodating and understanding. but the blame is all on me for loving him and having needs.
there's so many factors to this and so many versions of him, it's hard to wrap my head around it all",TrueOffMyChest,2025-03-07 23:01:38 UTC,4,5,0.67,,,0,0
1j62s93,Spoilers don't make me mad.,"I've never found myself being mad when a show/movie is spoiled. If I've wanted to watch it, I'll still enjoy watching it even though I know what will happen.",TrueOffMyChest,2025-03-07 22:56:09 UTC,3,3,1.0,,,0,0
1j62rt3,I seriously hate my parents,"They're so fucking stupid and annoying. They bitch at me(16F) and complain every 2 seconds over something small. Every time I've tried to tolerate their shit I end up crashing the fuck out.
quite literally ive tried to be nice and help a lot with stuff, I've done a bunch of chores around the house, even some chores they have to do, ive even babysat my younger siblings, just to keep them happy and their mouth shut.
but nah, I'm still walking on eggshells with them.
There's been a couple times I've been clumsy and accidentally knocked someone over, like my little brother when I was trying to sweep and he snuck behind me and i turned around then he fell over. And when that happens it's like absolute hell on earth because they yell at me and act like I'm some demon over it.
so, I dress one of my younger siblings for them because he's disabled and can't do that for himself, so I pick an outfit out for him for school and all.
when I came home today, I got berated over it because the outfits I choose ""ArEnT fAsIoNaBlE"" or whatever, like wtf?
And quite literally if I do anything wrong I'm berated called useless and other insults. I've literally went to the psych ward cuz I was suicidal and my parents decided to snoop through my room and my stuff, and basically When I got back they didn't even care if they were triggering me or not. They just used it as fucking fuel.
I just can't wait to get revenge on them, I don't give a fuck about how cruel I plan on getting revenge, but goddamnit I'm gonna make them wish they were never born.",TrueOffMyChest,2025-03-07 22:55:35 UTC,7,25,0.64,,,0,0
