id,title,selftext,subreddit,created_utc,score,num_comments,upvote_ratio,author_flair,link_flair,has_media,label
1j67irz,I feel like I can't find love.,"I (M21) am in my last semester of undergrad. So far in college career I've been on 0 dates, had 0 sex, and I also haven't had my first kiss yet. Anytime a friend would ask how I was doing with girls I would say that I didn't have time because I was taking 18 hours every semester. Partially, that was true. Depending on classes, it could be a particularly time-intensive thing. Though, I would try to get involved on campus whenever I could.
I guess, long story short, all my friends have had this stuff fall into their laps. I don't know why I haven't been so lucky. I'm worried that I'm past the point where having no experience is fine, and now it's leaning into ""sad"" territory. I think I'm decently attractive and funny, so I don't know what my issue is.
I am going to grad school VERY far from my whole support system and where I'm in undergrad. Im afraid the work load there will put me in a similar position to not be able to do anything.
I don't know, I guess I'm just throwing this out there.",TrueOffMyChest,2025-03-08 02:53:54 UTC,1,2,1.0,,,0,0
1j61gx2,I need advice,"To start off, I'm 27(f) with a 22(m) boyfriend. We've been together for almost 3 years, and we met due to working together. I still cringe at our 5 year age gap. I have a friend that is 30(f) and I don't know if I am a complete a**hole for wanting to cut ties with her, or maybe I already accidentally did.
The last time I saw her, I ended up staying for a weekend which was fun at first, and we tried to drink, but we both fell asleep too fast, which her boyfriend got mad about. I did not like this boyfriend (36m) due to him constantly sleeping with his ex and being so obvious about it but she'd be in this denial or whatever and cry to me constantly about it. He was also somewhat a neglectful parent to his daughter from what my friend would tell me. So anyways, the next day came and I agreed to stay an extra day to watch her two daughters, and figured I'd be getting paid because we discussed it prior. Well I didn't and during this, I ended up getting bed bug bites on my neck, hands, and ankle area. Pretty much where my skin was exposed. Since leaving there I still feel like I have bugs on my skin and I'm honestly afraid to ever go back. I don't know why I pick and choose when to be confrontational because I just let left and didn't say anything. I don't know whether to say anything at all. We've talked about bedbugs before and she's said she's gotten rid of them so I don't know what to say. Fast forward a few days and she tells me her and her boyfriend (36)m broke up and she's back together with an ex (32)m. This ex (32)m was sleeping with a 17 year old girl and my friend (30f) let both of them move into her home with her two children, before they both just dipped and apparently had left the place trashed and that's when the bedbugs originally came about around this time too. Oh, and that man(32m) knew her children for a few months and was having them call him daddy. I felt so uncomfortable witnessing all of this, and then seeing what she allows herself and her children to be put through willingly. For months I was telling her xyz was not right and she'd be defending herself and him (36)m until they broke up. At that point is when she is like oh I could never be with someone who does xyz and completely shitting on this man talking about everything she defended and excused, when she put up with it for months and would have continued to put up with it if he (36m) didn't have his baby momma over again to stay the night after she had been begging him to stop for months doing that for months. So I'm just over it? I'm like why are you actively choosing to put yourself through these things? I don't like to sugar coat things, because why the hell should I act like neglecting a child is okay just to be a girls girl? Their relationship wasn't abusive or anything like that, a lot of accusations of cheating coming from both & issues starting a few days after they began dating which is never a good sign but neither were afraid of each other it wasn't like that, and she will put up with almost anything to keep a guy around and that's my issue. I used to think she was a good mom, but I don't think she's that great anymore. I used to praise her when she would say she wouldn't let strangers around her kids and doesn't let anyone else watch her kids until I realized she's letting men she just met meet her kids inside her home, and be around them unsupervised. I used to think she was a good mom until I realized she raises her daughters through sugar and electronics, and doesn't really ""watch"" even though around her children. All of these realizations have come to me now after she broke up with her long term boyfriend of 2 years(34m) and have gone through 4-5 relationships in a year and I don't think she's the person I thought she was, and I feel awful but I don't want to be around someone like that. So she has her new boyfriend ex boyfriend (32m) currently living with her again, and I sent her a message a couple days ago saying I think that he's a pedophile and I don't want to be around him to which she's never responded, but has sent other things. I know that once her and her current boyfriend (32m) break up or start having issues, she will be wanting my pity party but I can't do it anymore. I feel like I have no empathy for her anymore. If we had more to talk about than her and her relationships I feel like it wouldn't be such an issue but she has no subsidence to her at all if it is not about a man. Any advice on what you would do in my situation? It's not my life so I don't know why I'm so bothered.",TrueOffMyChest,2025-03-07 21:57:32 UTC,1,0,1.0,,,0,0
1j674ys,The past few weeks have shown me that life will continue without me.,"Specifically, that my animals will be OK. One dog will go to my parents'. One will go to my friends who are obsessed with her breed (and if they find her another home, awesome). My bird will either go to the local zoo or the house down the street. My cat can literally go anywhere. I am not needed.
I promised my therapist I would reach out if I was planning anything. I lied. The gun in the house is gone but I still have the ability to purchase one amy day I'd like.
Work doesn't need me. We all know we are expendable at our jobs, but it's been hard for me to accept. But there's no other way to reconcile the fact that I've been at my job longer than two employees who have become managers and yet I'm nothing.
I'm useless. I'm dispensable. I'm nothing.
I'm about done.",TrueOffMyChest,2025-03-08 02:32:47 UTC,0,1,0.5,,,0,0
1j66syz,"Honestly, this is how I am learning to cope with being single/lonely for a long time","I hate to say that I am that guy who has been single for a really long time despite my best efforts, but I am. I (27M) haven't even been lucky enough to go on a date in like 5 or 6 years, but I have not given up hope even though things do look a bit bleak for me at the moment. I am a really busy graduate student, I try to fit in workouts and other activities too but it is pretty hard. I do not have a lot of extra energy left to put in substantial effort to find the right person for me on most weeks. So the thing I kinda wanted to get off my chest is I have been working on concepts/writing for a (fantasy) novel for a while when I get some time alone. With my life being romantically unfulfilled, I have fit in a relationship between two characters (the MC and another) to fulfill all the things that I have dreamed about. It was not really part of my original ideas for the story but it kinda just happened. Its pretty much all wholesome relationship stuff that I have never really got to have; the hand holding, the closeness, sharing feelings, tender moments, having each other's back, etc. As lame as it sounds, it has been decently fulfilling for me. There are still days that I really could use a hug even from a friend, but there is something about getting all the stuff I have always wanted on paper that has been pretty nice and comforting. Even though adding this stuff in has been satisfying for me, I am a little afraid it makes the writing worse lol, and when its all finished it makes me that much more afraid to show it to anyone. Some of my friends know I have been working on this but have no idea there's romance involved in it. I just really wanted to get off my chest I have been vicariously living out my romantic dreams through my fictional characters because I do not really have a better outlet. I think its been a healthy way to express what I am missing out on?",TrueOffMyChest,2025-03-08 02:14:59 UTC,4,0,1.0,,,0,0
1j66qwr,Damn I ain't naming names but a lot of posts here recently made me realise a lot of things in my subconscious that wasn't coming out to my conscious mind,"The gist tho are the relationship posts how you're just not compatible with someone nothing less nothing more
And that the wrongs of others are so shit it's intolerable and I hate it
I know pretty basic realisations but by god we are blind to our own mess til we see it in others hey?
Cheers to us all just trying to live our best lives here's more for the future !!!",TrueOffMyChest,2025-03-08 02:11:54 UTC,6,0,0.8,,,0,0
1j66ms7,My friend has a new boyfriend and I hate it,"I know it probably sounds like I'm in love with this friend but I'm not. I'm married and happy. But this boyfriend is an ex friend and ex boyfriend of mine and I was really close to them. They were my first friend in my new highschool where I didn't know anyone. One day a couple years ago they texted me saying all this mean stuff and telling me that we weren't friends anymore. They also didn't tell me what I did.
It hurt so bad for years, and I'm just now getting over it and I was doing good until I saw my friend posting about their new boyfriend and seeing my ex's face just hit me.
Even after we had broken up we were great friends and hung out almost every day until that text.
A really big part of me wants to stop being friends with the current friend, or at least keep my distance until I feel like I'm ready. I don't know what I'm going to do. Honestly I might just block them after sending an explanation. I'm a bad person after all so they probably shouldn't be friends with me.
Someone please help",TrueOffMyChest,2025-03-08 02:05:57 UTC,0,2,0.33,,,0,0
1j65zll,Update: I (23m) still love my ex (24f) and I don't know if she feels the same,"So we made the plans and I asked if it was a date or not, to my surprise she said it was which is just awesome to me.
We met on the train heading to the neatest city to us, I had zero idea where I was being taken but it was a small cafe not too far from a park and museum. We sat in there for around an hour before walking around the park and just talking, the weather did start to turn a little dreary so we went to the museum and listened to an organ for a bit before just walking around to see what had changed since we'd last been there (they removed all the old armour/swords and replaced them with old chairs?)
Towards the end we walked back through the city and got on the train. I got off two stops later than I should have just so I could walk her to her car and then we headed our separate ways.
All in it was a pretty fun day and we're thinking of going out for dinner next time.",TrueOffMyChest,2025-03-08 01:32:06 UTC,5,3,0.73,,,0,0
1j65j6m,My family hate that I go to bed earlier than them and I hate that they expect me to not do it,"I wake up 4:30am on weekdays to go to work so I have dinner at 7, go to bed at 8, so I can decompress and relax to then sleep at 9:30-10.
My family has been having dinner at 8:30 for about a month now because one of my sisters gets off work at 8 and they've been expecting me to wait for them but if I do so, I would be going to bed at 9-9:30 giving me little to no time to decompress and relax to finally sleep at a decent hour.
Pretty much 2-3 days they ask me if I want take out for dinner and everytime I say no because I can't wait for them because it gets late pretty quickly and everytime they get annoyed at my answer. Today a spin off of a show that we watch all together premiere and now my mom is complaining we won't get to watch it because ""I don't wanna eat dinner with them anymore"".
Is it so hard to empathize a little and understand I have to wake up very early to go to work? Like, why are they like this?",TrueOffMyChest,2025-03-08 01:08:41 UTC,252,42,0.97,,,0,0
1j65iqy,I got terminated from my volunteer position with no explanation,"So I (18f) just finished volunteering for the day at my workplace (animal sanctuary) yesterday, when I got a message from my boss to see he sent me a termination letter, nothing in the message either just the letter itself, and they have ignored me since.
Also sorry this is a long one, I just have a lot of things in my head I need to sort out.
So a bit of backstory, since I was around 14 I've been dealing with the struggles of depression, anxiety and adhd and ended up leaving school in yr10 because of it. Took a while to figure out but I ended up going to tafe to complete my cert ii and iii to become a qualified zookeeper as I've always loved animals and can't see myself doing anything else. Because of tafe I had to start volunteering to complete the practical component of my course and ended finding this amazing sanctuary to work at.
So I ended up starting there in early February 2024 and fell in love with the place and the people. I was originally going once a week but started going twice a week in around November bc I loved it so much and wanted to be there more. They always told me they loved how I would be there consistently every week and I would pride myself on it as it was a big commitment for me as I lived an hour away.
The environment there was great, honestly I couldn't have asked for it to be any better. The owners always quite involved and prided themselves on this and wanted us to feel more like family rather than a workplace. Because of this I became quite close with the people who were on my days and considered them my second family.
The owners also lived on site and their kids were always around, because of this I became quite close with them as well, even buying them small presents for their birthdays and helping them with their homework.
I suppose I'm telling you this so you understand how close I was with them, their family and the other volunteers, so you can understand how hurt I am by the way they've handled this situation.
Even on my bad days, they were half the reason I'd get up in the morning, even when I didn't want to drive, or talk to people, I'd still show up bc I didn't want to let them down, as again I seen them as my second family and greatly valued their opinion.
So fast forward back to yesterday, it was completely normal. Nothing out of the ordinary, we were still talking like normal, doing all our tasks as normal, having lunch together like normal, I even got a last minute tour and stayed back to finish it up, which brought in a fair bit of money for them.
Also just a note, it's a non-profit, all the money from tours goes right back into the sanctuary to care for the animals, food and water, vet bills, etc.
So just my little routine afterwards, I stop on the way home to go to the bathroom, get food, etc. So I was checking my phone like normal, and seen he sent me an attachment, funny thing is I thought he was sending me a dumb reel or something. Boy did I have a rude awakening when I read termination letter. So naturally I read through it and start crying because again, that day was normal, there was not even a hint that something like this was coming. Luckily I had one of my friends with me so I didn't do something dumb like driving with so many tears in my eyes I could barely see and probably getting into an accident.
In the letter he basically highlighted the fact that he wants to maintain a positive workplace and while he values my input, he needs to put the sanctuary first, blah blah blah, the typical things in a letter that would put the blame on me so he doesn't seem like the bad guy.
So one important thing to mention, they say this to everyone but from the start they said that they're the kind of workplace to make sure everyone's included and don't like people to form cliques. However, I became really close to two people in particular, specifically because they're great friends and have done so much for me.
Now while I was really close with these two, I feel we included everyone when we could. Especially since some days at the sanctuary we'd be so busy we'd barely see each other that day. So we'd always go out for lunch, however we'd always ask everyone if they wanted anything and never ate out, always came back to be a part of the whole team. (We'd all have a break at the same time.)
Now obviously being friends, we'd hang out after work, (but again we'd ask some people if they'd wanna come if we weren't going too far away.) And we would call and stuff, but I feel it's normal for friends to do that.
So one thing I could see where they wouldn't have been to happy with this, is that we were doing an animal course about 5 hours away. You have to finish the online part first before you go do the practical bit. So one of my friends told the boss that we were going to be doing it (he already done it prior and was just driving us), and unlike the last time it was done, they didn't put it on the group chat or anything for people to say they're interested. I think they assumed we'd tell people that we were doing it and ask if they'd want to come. Mind you this was about a month in advance, so plenty of time for people to do the online section. I will say this course ends up being quite expensive so some people weren't able to do it due to financial reasons anyway.
Anyways long story short, one other person from the sanctuary ended up doing the course (btw the course only has 4 spots for the Prac part). We had a great time and included him in nearly everything we did (he traveled separately to us so was only left out of stuff we did on the way). We even had a game night and everything and really the only people who were left out were the people who couldn't come but wanted to, which I don't blame them for.
I can only assume that this is the reason they fired us (my friend that drove was quitting, next week was going to be his last, however they messaged him yesterday basically telling him to not come back, and my other friend also got a letter similar to mine.)
Again, I was completely blindsided by this, as yesterday and even the last few weeks were completely normal. No they didn't even try to chat with us, saying something like, 'hey this is what we can see is happening and we don't like it, can you just try to include the other people more'. Something like that and I wouldn't have been as devastated.
The only other thing it might be is that I would make some pretty crude jokes, although I wasnt the only one that would say them, and me and my boss would say them to each other and everything (we're Aussie btw, it's part of our culture I suppose, if we don't know you or don't like you, we'll be quite civil/polite to you, but if we do like you then you'll probably cop it.) although I don't think this was the problem bc again it wasn't just me making these jokes.
I guess what hurts the most, is that I really respected my boss and viewed both of them quite highly. Like they're great people (at least I use to think so), they're great parents, really community oriented and from what I've heard, quite highly regarded in our field. So basically for him to not even have the decency to even send me a message along with the letter it is what hurt the most. So naturally I sent them both a message, asking them to give me a call bc for my own peace of mind, I really need an explanation. Both of them (I assume accidentally) opened the message and I can see they read it, however they both ignored it. So I sent them an email this morning, however still waiting on a reply.
I've never been through a breakup but I imagine it'd be like this, except instead of breaking up with one person, I've just lost my second family. With no warning, no explanation.
Anyways thanks for listening to me ramble, sorry it was so long, I'm just kind of at a loss for now. Hopefully I'll stop crying and get out of bed soon. Thank youse heart_hands
TLDR - I was volunteering at an animal sanctuary when I got a termination letter from my boss, with no warning, no explanation. I feel like I've lost my second family.",TrueOffMyChest,2025-03-08 01:08:02 UTC,4,4,0.83,,,0,0
1j65b2d,I'm being sued for something I didn't do,Hi I'm 24F & back in July 2024 I was at a stop light when a guy got out of his car & started yelling at me because I was too close to his car so I rolled my window up and that's when he got even more mad and tried to get his hands in the window before it closed but luckily it closed on time so he just banged my window. I didn't say a word to him and just kept on driving but that's when he reversed into my car and hit me. I called the cops and they said it was my fault because based on the damages it looks like I hit him and it was a he said she said situation. Fast forward I just found out I'm being sued today by him. Idk what to do. I'm also in nursing school & im scared I'm gonna get kicked out.,TrueOffMyChest,2025-03-08 00:57:33 UTC,1,2,1.0,,,0,0
1j6595g,How my step moms been treating me,"So basically she's just been up my ass for the past couple months and I'm getting sick of it. She's lied to my mom about me, completely ignores me and clearly favors my brother over me. I literally can not handle it anymore. I don't even like being in the same room as her because she brings down my mood. All her and my mom do is fight and it's too much, all my mom does is complain and say she's gonna kick her out but she never freaking does. I've had a rocky relationship with my mom but it's getting better but my step mom makes me literally want to move out. She complains when I do literally anything or if I go anywhere. Like a couple hours ago I used some nail clippers and a nail file to do my nails and I used hers (mind you she uses my shit all the freaking time) and me and my family used to Sharing stuff If someone needs it and she texted me while I'm at work bitching at me telling me not to use her shit and she's sick of me. I told her sorry and she just kept going demanding that the minute I get home I gotta give them to her (which I already planned to before but I had to leave for work) I'm literally a minor and I work two jobs and she's always on my back calling me lazy and spoiled. She loves to compare her childhood to mine (she didn't have the best childhood) she told me I'd never make it if I went through what she went through, mind you I've been through abuse and assault ontop of that depression and anxiety. I literally just want her to get off my back, any advice or help? (Sorry if there's spelling or anything I'm at work writing this)",TrueOffMyChest,2025-03-08 00:54:50 UTC,1,0,0.67,,,0,0
