id,title,selftext,subreddit,created_utc,score,num_comments,upvote_ratio,author_flair,link_flair,has_media,label
1j629ya,I am having problems with my relationship and I feel trapped,"I don't know where to start with it all. This is going to be long, and if any of you get to the end, I appreciate you taking the time to read my story. I would say that this feels like a common place story that happens to a lot of people in different ways. I just need to get my story told. almost feels like I am just asking for pity, maybe I am, and that is an issue with myself because seeking pity is not good for one's mental health, but what I've been holding in also isn't good for my mental health. I'll start the story at 4 years ago when my relationship started. It started 7 years ago. I start there. I was a lonely type of fella and I did not have much relationship experience from my time growing up and being in high school total of 2 relationships before this current one I find myself in one 8 months with it ending with me getting cheated on and the other 1.5 years with me proposing and then getting cheated on. Both in-person and then transitioning to long-distance, you'd think I'd learned my lesson the first time. Anyways, I go about a year of being single and searching for love as all young people do, and nothing worked for me: dating apps, social events, or just finding people in places that you'd want to be able to share interest with. Until one day, I posted a nice thirst trap online to get the self-seeking validation that I felt I needed at the time, and someone slid into my DM's someone that I had known from HS but never truly talked to. I began talking with this person, and then we grew closer every day, despite being long distance with a 3-hour time difference. We Facetimed each other every once in a while and then twice a week and then every day. The problem at the time in that relationship was two things: I was not emotionally intelligent, and I had a group of guy friends that were semi-toxic. My significant other was not fond of my friends as they wanted to go out and party all the time, which I didn't mind doing, but it wasn't my cup of tea. So I spent more time talking with her, and then one day I tried to introduce her to my group of friends on Facetime, and she talked to everyone a little bit and just found them all disgusting and asked to talk to me again. She said something along the lines of Wow, can't believe you did that and hung up on me. Now for me, I was confused because my buddies did the same thing with their signifcant others and no one was upset and it was nice getting to know the person they loved back home(for a little context me and my SO had not met up yet we were still having facetime and what not). It was also a surprise for her because when she called, I was hanging out with my buddies, and one of them picked up. So after she hung up I called her back in private and I asked her what was wrong and she told me that she felt disrespected by what happened and that was our first big fight with each other, and it ended with me texting her updates of when and where I am so she knows if she can call with me. I agreed with it all, not thinking that it was a big deal. We continued the relationship with one another with basically a gradual turn of all my free time being spent with her. I neglected friends and became somewhat isolated from my world. As an inexperienced youngling, I didn't see that issue. I kept the good friends and started distancing myself from my friends we'd hang out with, but it started to be less and less as the month went by. I would say that we are about 8 months into this relationship with each other when we first decided to meet up with each other and have about a week together. Now before we met with each other she alluded that there were things that she wasn't going to give me or ask of me unless we were dating because I hadn't asked her to be my girlfriend and I don't know why but that enticed me to figure out what she was alluding to and that brought me to the point of when meeting up with her I asked her to be my gf and she said yes but I was so nervous asking her it felt like she was a bit hesistant on that matter when replying yes. That happened the first day, and then we started dating with our first week in a relationship of hanging out with each other. I stayed at her place the whole week, and we did various things and hung out with each other. It felt like things went well for the week that we spent together; it felt like we connected, and everyone had a good time before we had to say goodbye and continue our long-distance relationship. After I got back to my home things started to change with our relationship she wanted more from me in ways of being more emotionally aware of my day and tell her my feelings and how things made me feel and as the emotinally unintellegnet person I was it was hard for me to change that in my everyday life, I was just going with the flow of life and never realy discussed my emotions with others becasue it never really came up in conversation. We argued about how I was still just discussing my day with her and not sharing my emotions with her, so I worked on it and slowly got better with being in touch with my emotions, yet I feel like it was never really enough for the relationship. As the months went by, she continuously felt like I wasn't telling her enough about my life and felt left out the more I told her about my day, so I committed to telling her everything that happened in my day as she was doing to me. Now, my struggle was that there was a lot that happened in my day, so I would sometimes do it when it happened in my day. Still, I would eventually tell her about it when we called each other every day. Still, she would then get upset that she missed out on knowing when it happened and what I felt in that period. Once again, being the emotionally unavailable guy I was, I tried my best to do what I could to satisfy that need for her. At this point, you're probably wondering why we just didn't break up. I have no clue; it's probably just me being weak-willed. At this point, I spent just about every waking moment texting and talking to this girl, and we got into arguments just about every single day, either about me missing information I was telling her or me not being emotional. Being young, I thought this was healthy because the arguments led to deeper conversations with each other and figuring out what made us who we are. I would say about 4 or 5 months after our initial meetup, I had pretty much completely distanced myself from my friedns with rarely ever hanging out with them but maybe once in a blue moon, but it made it harder in my relationship to hangout with them becausea of her wanting to know everything and me jsut wanting to spend time with friedns so there was communication delay from waht was happening in the conversation and what I was doing vs what was acutally happening in my life. This all led to arguments down the line, and then our next meet up, this time I was meeting her parents and she was coming to me. I set things up so that I could stay with her and got a friend that I was closer with that she seemed to like because he was married and approved more of our relationship. We spent the time together for about 2 weeks; this time, one week just me and her at my ""place"" and then a week with her parents. It seemed like another good meet up with both of enjoying ourselves but, a little bit of tension between us from the arguments and the fact I was moving from a 3 hour time difference to a 13 hour time difference, which we both imagined would put more of a strain on our relationship, her parents liked me on a side note. We parted ways, and I began my new path in life with her being in college and me being abroad for work. We had both been right tensions did increase with each other as I was abroad it became even hadrder for me to comunicate with her with everything that was going on in my day to day life as it was for the most part always unpredictable and hard to keep up with myself and she would sleep half way through my day as the time differnece so if she didn't wake up to a butt load of text about my day she felt upset and always had this feeling of misisng out on my life, so I continued to distance myself from others and not participating in group events and when I did I tried to keep to myself to minimize the updating I had to do. At this point, she just felt like I didn't love her because I wasn't involving her in my life the same way she was involving me in her life. She told me everything about her day, so this wasn't a double standard, and she was also busy, but I would say that I was definitely busier than she was. I continued to apoligize about the communication issues with keeping in mind I still was telling her about everything that happened in my day whenever we talked on the phone especially all the things I forgot to tell her and she felt that I conviently kept forgetting to tell her about the interations that I had with Females throughout my day beacuse as you can imagine she was jealous that other females got to interact with me throught out the day more and she didn't. I was better about telling her about female interaction through my day, but I still missed a few here and there. Sometimes, I got rides from females, and she'd get upset that I didn't tell them when it happened. She always felt she never got the full story the first time and she had to ask multiple questions to get the whole story and that was tiring for her and it got to the point where, I thought I was doing a good job but was not and I just gave up on updating her one day because life just got overwhelmed and I couldn't handle life and my relationship at the same time and she ended it after that day. I was devastated as we had been going through this struggle for almost 3 years, and it just felt like it was all for nothing. We met a third time before breaking up and were going to meet up a 4th before COVID-19 occurred and travel bans happened, which didn't improve our relationship. We broke up, I got friends, and started to move on with my life, slowly finding myself and what makes me happy. For about a year, I was single. I decided to move back to the same timezone as her and go to the college that she went to. Not expecting her to be in the area, not ever really knowing why I did it either. I wanted to complete college not being in a relationship, but that was not what occured. As you can expect, we ran into each other again and started dating because she felt like I was a changed man and was able to prioritize things in my life a little better. I can say that I did grow in the time after we broke up and explored my inner workings a little more. The thing is, she thought I started dating her again because she was a different person, but she hasn't really changed all that much, still wanting the same things, and I was more able to provide those things she wanted, and it felt like things were going in the right direction. We moved in with each other and where ""dating"" for a year until she said that she wanted more and didn't feel we were growing and she said it was because I had not asked her to be my gf so about 3 months of me trying to find the right time to ask and it not working out we get into an argument about it and I asak her and she says no ask another time. So I don't plan for it and just start asking her once a week until she just says yes about 2 months later while we are living and sleeping in the same bed with each other. Anyway, things started getting a little tenser between us. I don't have many friends as I learned not to make friends in this relationship, and I don't talk to my old friends much because it just causes conflict, and I'd rather avoid than lie. We continued dating, and for about 2 years, we lived in the same place. We have had our ups and downs through the two years. I changed my job twice and have a female supervisor; as you know, she is upset about that, but she ignores it better. She says she just, at this point in the relationship, buries her emotions and hides her concerns because she doesn't want conflict in the relationship, and she only ever feels that she has problems with what is going on in the relationship. We still argue a lot and have those arguments turn into deep conversations, and I become more and more emotionally drained as these arguments happen, and I can barely keep up with my studies, work, and relationship, yet I push on. We are starting to get to the real point of this story and why I am just done is that we were initially very active sexually in the beginning of our relationship like once a week and then it moved to once a month which you know I didn't think to much of it because I figure sex drive just went down as the relationship got more secured, but we just moved to a new place and signed a 15 month lease that niether of us can afford to break and I tried to be sexual with her this morning and she told me that it felt nice but shed been thinking of her ex when we've been doing stuff and that its kinda always been that way becasue she used to be very sexually active with her ex but he was fine with not having sex and she puts herself in his position and wouldn't want that pushed uponed her and makes her feel sad and turns her off from anything that we are doing and I tried to help her get to the root of it this morning before leaving to work and I just felt that I disrepected myself by doing that and not being more upset about her thinking of her ex and it just hurts because it means just about everytime we do sexual stuff its about how she feels about her ex and makes sense why she has to sometime watch things when I go down on her. Honestly I know that this is a super toxic relationship but, I love her so much and have tried so hard in this relationship with the time and effort I put in everyday it just sucks all of it
TLDR; GF thinks of ex during intimate time after 7 years of relationship and gets turned off just about every time because she pushed herself on her ex, and her ex didn't care about having sex and she didn't like the idea of being in his position. So it has tanked our relationship, and everything feels distant and We moved to new place with 15 month lease no one can afford to break. I feel stuck",TrueOffMyChest,2025-03-07 22:32:58 UTC,2,1,0.75,,,0,0
1j626pw,My chronic illness has taken my will to live,"I (22 F) have had a chronic condition for more than 10 years now.
The thing is, it's something I haven't seen mentioned before or other people experiencing it. I feel so alone and I've seriously considered an ""escape route"" in the sense that I genuinely do not have a will to live.
I have a chronic sore throat and it's ruining my life. I cannot drink or eat anything cold without getting ill after. Absolutely anything. **I cannot just eat ice cream and enjoy cold drinks.** I always have a lump in my throat no matter what I do. After I eat/drink something cold or when I'm sick, this lump gets thicker and inflammation follows.
But the worst of all is second hand ciggarette smoke and other dense smokes. Just feeling it makes this lump get thicker and I start coughing.
I cannot walk normally on the street and always have to avoid smokers that are everywhere. I cannot go out to bars, hang with people my age because they're all smoking. I am the insane one.
The doctors do not care since there is no concerning inflammation and I've been told to just deal with the smoke and ""avoid"" it as if that's possible. (I live in Eastern Europe) I've also had my tonsils removed, because the inflammation affected my bones and heart, but even after that, there's been no improvement.
The thing that's causing it is a bacteria called staphylococcus aureus and this chronic state most likely developed when I failed to do a treatment properly. I've been desperate to find an explanation for my pain on my own and was able to find just one scientific paper studying the sensitivity of this bacteria to second hand ciggarette smoke.
I wish I could live somewhere isolated without pollution from smoke, but it's not likely since I'm just an average woman. No skills to survive on my own, nor the resilience for that. I am so tired.
I do not see a future for myself. I've never had a relationship due to some other reasons in the past, and I don't see myself having one because of this.
Also sorry if this isn't the appropriate sub for this. I mostly posted this as a cry for help and maybe to attempt at finding people who relate. I'll remove my post if needed. Thanks for reading.",TrueOffMyChest,2025-03-07 22:28:51 UTC,5,1,0.67,,CONTENT WARNING: SUICIDE/SELF HARM,0,0
1j623o7,I just broke up with my partner because they didn't even realise they'd cheated on me,"Life is feeling real batshit today.
Came across my partner's alt account on social media. Open to public viewing. They described it as an 'orgasm journal' where they seemed to be exploring self pleasure. Cool, love that. Very data-driven. Cut to a post about 'collective' episode with another online user. They had been exploring what sounds to be a lot like mutual masturbation where you're turned on by the idea of someone watching, viewing things through a data-driven lens in the name of 'research'. Naturally I lost my shit and messaged them.
We called and I told them all of the assumptions I'd made. They didn't say I was wrong, just said 'it's research'. I feel like I'm getting pulled into insanity and delusion here. It feels like kink gone wrong. What do you mean it's research?? Research is ethical? Having sexual conversations around topics that arouse you with another person for the purpose of sexual pleasure sounds like infidelity to me?
I can't believe I had to tell this person who most of the time has their head on square & thinks intelligently and rationally that this constitutes as cheating. It's not research or data what are you talking about!!
They've just posted after our break up (yes I'm going to stop looking but it's been 12 hours please let me wallow) that they're open, not poly. Fast fucking turnaround when we were in a monogamous relationship literally 8 hours ago.
We were in a long term relationship and I cannot for the life of me process that this is the way it ends. Can someone please tell me I'm not going insane?
Edit: just to clarify - we've had in depth conversations around our expectations of a monogamous relationship. I didn't specifically set a boundary of 'I am not comfortable with mutual masturbation online in the name of research' because.. that's very specific and not at all a normal conversation to have, lol. but I did explain what would be uncomfortable or deal-breaking for me and I would fully put the onus on them to have needed to clarify in this situation instead of going in blind because I think it's very clearly something I would take issue with based on every other conversation we've had on the subject.",TrueOffMyChest,2025-03-07 22:25:00 UTC,2953,110,0.97,,,0,0
1j61ohl,My sister's life is ruined ig?,"TW: drug abuse
So, I don't know how to start. My sister has/had a long-term relationship and I even considered him my brother because he was like that with me. They even have a child together. It all started last year when my bil asked my father for 400 but not to tell my sister and he would pay it back as soon as he got paid. To this day he never payed back and he lost my father's respect because of this. We suspected that he may be doing drugs but we kinda hoped he wouldn't do something like this because he loves his child to the moon. There were few incidents where he acted off we never interpreted much into this and just hoped everything would be okay. He works in a field where the future is the secured and a few weeks back he told us that he and his other colleagues were laid off but they would all receive loan payments till the contract ends. Idk it came with a surprise and I had a thought that maybe he was the only person that got laid off. I asked my bf about it because his father works in the same company but in a different department. He said he didn't know anything about this. Well, wednesday was the incident that ruined my sister's life. We don't know what happened exactly but my sister has ended the relationship for good and threw him out because she found drugs. She told our mom that he had a history with drugs a long time ago but he swore it would never happen again. Since yesterday he is supposedly in rehab. I don't how to talk to my sister about this and I don't know what to think myself. He was like a brother and I always defended him to everyone. I am scared what will happen in the future, I mean what if he collapses again? Right now my sister is a single mom who works full time with only a half day daycare. I don't know whether my bil was under influence when he was watching my nibling. There were times where he was alone with my nibling for two weeks. Was he driving under influence? And was my nibling with him? For how long was the abuse? Will my sister recover from all this? Was he thinking about what his abuse will do to my sister and nibling? Was he even thinking?
There is only so much hurt that a person can endure and my sister had enough in her life. My mind all over the place and I have so much questions I would like to ask but I know that I can't get an answer. I would like to tell my bil how disappointed I am but I know that this would not help his rehab. My mind is all over the place and my heart is hurting and I can't talk to anyone expect my mother but she feels the same way expect that her heart hurts more because this is her daughter. I don't know what to do right now. I don't know what to think. I don't know what to feel. I don't know how to help my sister.
I had to get this off my chest, thanks for reading",TrueOffMyChest,2025-03-07 22:06:17 UTC,2,0,0.75,,,0,0
1j61hol,I stopped focusing on myself because of my husbands actions,"Me and my husband have been married for 3 years and we had a rough start to marriage, we were both very toxic to each other and ended up putting hands on each other, but over time we go the help we needed and we are trying to rebuild but it's been difficult very difficult. He was a virgin when I met him, and he was my second partner Ive been with. Lately I've been feeling very lonely and discouraged from trying to be ""sexy"" around him, before we got married and were dating he was very horny all the time and wanted it almost 3 or 4 times a day but now I'm lucky to even get with him once every week or 2 weeks and I've noticed that it's always me initiating it, also he doesn't really touch me he straight just only goes to fumble my boobs and nipples then goes down on me then we only do missionary and doggy that's it and it takes about 30 min.
Once I didn't initiate at all and wanted to see how far he will go to not having sex, it was a month and that's because I couldn't handle it anymore. Recently I've been trying to talk to him about it but he says that he wants to build up emotionally because of our past and doesn't want to focus on the sexual stuff which I feel is important too. I've bought lingerie to maybe inspire him but all he does is say I look beautiful and that's it he doesn't go feral he doesn't dirty talk, he doesn't admire me, he doesn't role play, he doesn't grab my ass nothing, we don't even make out.
I'm starting to feel more like a roommate, I stopped putting in the effort of being a ""woman"" I stopped shaving I stopped plucking my eyebrows , I stopped waxing or trimming, I shower only once a week, because I thinks what's the point? And yes I've brought this up to him multiple times and he says I still look beautiful and that's he still loves me. I just don't feel wanted or desired, I don't know how else to explain it to him. I've said to get home and throw me on the bed and fuck the shit out of me but he says that no because he comes tired from work and dirty, which I don't give a fuck, I've told him to look for more positions to try but he always says well you research and I'll do it. Which I dont want I want it to come out of him to want me to desire me. Ive put lingerie on and once i really out did myself i got my hair done and shaved trimmed everything but then he said that he doesn't get turned on by lingerie, but he also doesn't know what turns him on. Also one time we were getting into it and he pointed out I missed a spot when I shaved down there which made me feel really embarrassed and we ended up not doing it. I don't know what else to do really I've brought this up to him a hundred times but he never gets the point and leaves it to me. What do I do? I feel so frustrated with the situation",TrueOffMyChest,2025-03-07 21:58:26 UTC,3,6,1.0,,,0,0
1j61gr1,Broke Up With Partner But The Real Reason Is His Penis Didn't Satisfy Me.,"We were in an open relationship and I have several other regular sex partners of 10 years and five years. I also have hookups with others. There were some differences that caused me to end the relationship. However I am a size queen and know I need it packed to feel fuflilled. Needless to say, it afected my satisfaction a lot! I'm really sad that I settled for someone who didn't satisfy me. I tried to approach sex life as something for us to build on. As this was a newer relationship. But I never craved him when we were apart and I would not miss him physically. This signaled an end to me! I guess size really does matter and I just needed to find out.",TrueOffMyChest,2025-03-07 21:57:20 UTC,0,7,0.24,,,0,0
