id,title,selftext,subreddit,created_utc,score,num_comments,upvote_ratio,author_flair,link_flair,has_media,label
1j657gu,Am I being used?,"Am I being used?
Do I (26F) need a reality check? I've been friends with my friend, Blake (26M), for over a year now. We have been pretty close since the beginning. When we first met, we bonded over our shared love for playing soccer together and music. I would say we have many similarities. We both enjoy adult animation, like Studio Ghibli, raves, and playing board games. Since we shared many similarities, we kept in touch daily through text messages, phone calls, and FaceTime. We had a mutual friend named Jennifer. Jennifer and I were very close until I noticed that whenever we spent time together, she spoke negatively about everyone around her. As a result, I gradually distanced myself from her. Around the same time, Jennifer and Blake started dating. Although I wasn't close to Jennifer and didn't personally like her, I wanted Blake to be happy. Blake and I maintained a consistent relationship and communication. We talked every day, even during our lunch breaks, via FaceTime. However, things took a turn when Jennifer informed Blake that I had feelings for him and wanted to pursue a romantic relationship with him. That was not the case, and I was even in a relationship at the time. As a result, Blake ended our communication to preserve his relationship with Jennifer. We did not talk for eight months. However, in January he reached out to me. He told me that Jennifer suddenly broke up with him in December. Since then, we've been hanging out again. In February, we attended a rave and ended up having sex that night. A week later, we confessed to each other that we had both harbored feelings for one another since we've first met. At this point, I informed him that I didn't want to be a rebound, and he responded by stating that he wasn't ready for a relationship and wanted to focus on healing. I accepted his decision. We continued spending time together and continued having sex. However, I later told him that I no longer wanted to have sex with him because I was struggling to separate our friendship and romantic feelings. Around the same time his ex-girlfriend, Jennifer, filed a protective order against Blake.
Sidebar: Personally, I have had past experiences with abusive men, which may have influenced my perspective. However, I must admit that I am not entirely aware of the details of Jennifer and Blake's relationship. Given Jennifer's personality, I can't help but wonder if this situation is a attention-seeking ploy. On the other hand, I have only heard Blake's side of the story.
However, I suggested that we establish boundaries. We agreed to refrain from having sex and I told him I need a break from constant communication. I also told him to fine another trusted friend to confide in about the Jennifer situation because I haven't healed from my own trauma from the abusive I had endured. Blake expressed his agreement to the physical boundaries and expressed he didn't want to lose me again and our friendship.
Since implementing these boundaries, our relationship has undergone a significant change. We don't talk that much anymore and when we do the protective order case seems to be the main topic of discussion. Although, last night, I visited Blake's place to watch Star Wars. During the movie, he asked me to engage in a platonic cuddle. We did, and he said Thank you. I inquired about the reason behind his gratitude. He mentioned that my presence was naturing and made him feel less lonely. Am I only in his life because he feels lonely?",TrueOffMyChest,2025-03-08 00:52:22 UTC,2,4,1.0,,,0,0
1j652ed,My husband had a thing for a dog and now I'm rethinking him as a person,"Three weeks ago me (28f) and my husband (29m) went out to a bar. When we got there, we happened to run into a middle school friend of his. We got to talking and his friend was sharing stories about when they were in middle school together. Like the time his friend walked into the wrong restroom by mistake and was made fun or for a year and when my husband got hard asking out a girl, after a few more embarrassing and funny stories his friend who we'll call Jeff says ""hey remember that dog"". I think you can see where this is going. My husband started breaking down laughing and I was totally confused. So I asked ""what dog"" Jeff explained in sixth grade was/is/whatever the terminology is a ""zoophilia"" he was sexually interested in a dog named ""champion"" he didn't do anything but got a boner after he was playing with this dog. He and his friend shocked about it for a while but he kept taking pictures of this dog. It started to move from joking territory to creepy. Three months later, he attempted to kidnap the dog. Thankfully, Jeff's father (the owner of the dog) caught him.
Is it weird that I'm reconsidering my marriage even though this hasn't been a problem in decades. My whole view of my husband has changed, so am I over reacting to my husband's middle school issues?",TrueOffMyChest,2025-03-08 00:45:17 UTC,2640,425,0.95,,,0,0
1j64ucy,The Animation industry is making me think dark thoughts.,"Hello. I'm posting this on here because anywhere else I could be found out.
I'm a recent graduate who studied animation. I want to be a character animator working with studios or even just contract/ freelance work.
But nobody is hiring juniors or graduates. I aced my grades. I've been given compliments on my reel. I have connections. I did some experience only to be ghosted.
LinkedIn and indeed are only posting Senior, Lead, or Principal positions, even if it's a mid position they won't hear back from you. Even when I reached out to people they said they liked my work but weren't hiring.
In 2023-24 I reached out to over 115 places. From 2023 to now I have a spreadsheet and I'm on application 724.
Axis Studios shut down, Technicolor and its subsidiaries shut down so now there's an even bigger pool.
I feel hopeless. I feel empty. People telling me that AI will take over me too, there's nothing anymore. All I've ever seen myself as is an animator and if I can't be that I don't see myself doing anything else and I can't fathom doing anything else that it's making me think horrible things. That if I can't get a job or if I'm stuck and the industry fails and I have to switch I'll be at square one and I just can't.
What can I do. I'm so scared and hopeless.",TrueOffMyChest,2025-03-08 00:34:13 UTC,0,0,0.5,,,0,0
1j64p36,I think about the one that got away even though we were never together.,Due to trauma I have an extreme flight feeling so that even though things are going good with my current partner I keep thinking about just packing my things and leaving. I keep thinking about a FWB I was with prior that if we had tried a relationship probably we probably would've been great together. I love my current partner and don't want to actually leave him and I can't say anything to either of them because I won't let my trauma response ruin a relationship and friendship. I am working on it with my therapist. I know that if I do pack up and leave and have something with the friend that the same feeling will happen with him because I need to work through the trauma rather than giving into it. I don't really have any friends I can talk to about it because none of them will understand.,TrueOffMyChest,2025-03-08 00:27:03 UTC,3,0,1.0,,,0,0
1j64g7u,Coming to terms with the thought that my sister is not a good person after all,"It has been almost 15 years since it's slowly started to dawn on me that my sister never really loved me: she just thought I was so much lamer than her, that she didn't see me as a competiton.
For the context: she is 10 years older than me and for as long as I can remember, I loved her more than anyone alive. I loved her more than our parents, brothers, friends etc. She was my absolute role model and everything she did was perfect.
It is fucked up to compare kids ever, but when parents and relatives are comparing two people who are so different and not even in the same age group, that is especially fucked up.
She was always labeled the beautiful one, me as the smart one. She was the caring child, I was the mean one. Her life was hard, mine was easy.
Everything that was happening to her was always celebrated if it was good, or we were all devastated together with her if it was bad - and it was never her fault when it was bad.
Everything I ever did was considered as luck, or as normal if it was good and my fault if it was bad.
She loved me back and always worked on building my self confidence - but never to the extent of me succeeding in being better than her in any way. This was particularly obvious in her relationship with our parents, where she told me multiple times that our father wanted mom to have the abortion when she was pregnant with me. Any sign of me not liking that thought was being met with the comment along the lines of ""me being too sensitive"" or ""oh, come on, he loves you now"". I reacted explosivelly about that only once, when I told her openely to go fuck herself with those fucked up pieces of info, which, of course, ended with her being in tears, appologizing, and making me promise THAT I WILL NEVER REMIND HER ABOUT THAT EVENT. She made it about her and her feelings and I was told by the involved parties that I shouldn't have been so hard on her.
These were occasional outbursts, when I would always make a conclusion that I over reacted and I would end up crying, begging her to forgive me and promising never to do it again. Bear in mind - we are talking about my teenage yeara here, not adult me.
FF to my 20s: while she had one relationship with her then long-time bf, who became almost like a family member, I mostly fucked around and either didn't really meet reciprocated feelings in guys, or I didn't even want anything serious. She eventually broke up with him - it was a family tragedy, ofc, like anything bad that happens to her - and she somehow put us both together to ""we are never getting married"" file. I mean, she never said it, but it was obvious that she is not supportive of my potential relationships. I kind of knew it, but I became sure about it when I started to date my now husband, when I was 25, and as I became more self-assured because I felt loved, she started to become more and more openely toxic, and she was doing it often. She would use every opportunity to let me know she thinks he is lazy and irresponsible, while I didn't think any of that.
She started to hate my hobbies, style, habits (which didn't change much - I just wasn't as miserable as before) and she was suuuuper pissed when she broke with her second bf and I got engaged.
She called me and raged about how it is inconsiderate that everyone is saying ""congrats"" on social media, while they are aware of her recent break up. I felt bad because during the last year of her relationship she lost one pregnancy, but I still didn't think that I should hid posts my boyfriend put on social media when he proposed.
After that, it all went downhill.
She was good to me either when something super good would happen to her, or when something really bad would happen to me.
She hated my wedding day and pregnancy, but she was full of understanding when I had PPD. She did nothing to help, but she was good to me then.
As soon as I got better, she was hating me again. In the meantime - all good that was going on in her life was still celebrated and all bad was mourned, while my life was kind of unimportant to our mutual loved ones (mostly).
I started to fight back, but I was rarely talking shit about her to our family, while she wasn't really private about her opinion on me. Every time when she would show her good side again, I would come back to life because I would regain the hope that the most loved person from my childhood is still there.
Recently, I lost all hope that I will ever want her back in my life. Our father died and in his final months, while I was crying my guts out and doing EVERYTHING to help him - as we all did - she told me that I was selfish as always and not showing any empathy towards him.
That was the straw that broke the camel's back for me and I screamed at her and told her to get the fuck away from me forever.
We did communicate after that, because there were many things that had to be done with our dad, and I was there for her to be her shoulder to cry on when she needed me, but it was just because I felt I had to, for the rest of our family.
As our dad passed, my feelings of disgust came back and I am back to feeling hurt by our last fight. She mentioned it briefly and said that it was just a dumb fight, as she always does after moments like that, but to me - it wasn't. To me now, none of the fights we had were dumb and they were all about one thing: her wanting me to be the obedient, loser sister that she had when I was from 0 to 20-ish and her from 10 to 30-ish.
I can't stand the thought of her hanging out with my kid anymore. My kid loves her and I was so happy when my sister and I patched our fight from a few years ago and she had good relationship with her niece, but honestly - I have two fears:
1. She would fuck her up the way she fucked me up,
2. She would be telling my kid mean things to show me as a bad person, for whatever reason.
One thing I found out later, after my PPD was gone, is that she was planning to take the kid away from me ""because it seems like I am not fit to do it"", but she never considered talking to my husband about it. Like, he didn't have PPD, he was fine - why didn't she talk to him? Why was she planning to adopt the kid who was not out for adoption?
Anyway... I am done with her, but I think I will need a lot of time to process this. Maybe therapy would be beneficial.",TrueOffMyChest,2025-03-08 00:14:59 UTC,6,0,0.81,,,0,0
1j64e6n,I hate living with my parents so much,"I moved back home recently after graduating from college and living with my parents again has made me cry more than I did during my four years at college. I found out today that my mom opened an enveloped addressed to me and read mail intended for me that included a lot of personal information. She left the letter in her room for at least three days without even telling me I had any mail, and only mentioned it today. She's also been using the personal info in that letter to make fun of me.
Yeah, I'm lucky to have parents that will welcome me home and that feed me. They're not bad parents. But living with them genuinely makes me want to die.",TrueOffMyChest,2025-03-08 00:12:09 UTC,1,4,1.0,,,0,0
1j64ccx,Close friend passed today at 28,"You know how we always talk about how great someone is once they've passed? This friend was truly one of the best people I've ever known, hands down. I truly, honest to god, do not have a single negative thing to say about him. We've been friends for 20 years. We grew up together. He was the most himself person with a huge heart. He followed his passions in a way I rarely see, taught children who adored him, and was just such a damn good friend and person.
During the last conversation I had with him over Christmas, he told me he was the happiest he'd ever been. Doing what he loves every day. Pursuing his passions. I was so so happy for him. That day he also met the man I'm going to marry for the first time and told me how much he liked him. It's hard to imagine he won't be at my wedding now.
I know there's no rhyme or reason to death, and I won't waste my time on arguing with it, but man, if anyone deserved a long, happy life, it was him. I feel extremely sad and just needed to get it off my chest.",TrueOffMyChest,2025-03-08 00:09:37 UTC,12,1,0.94,,,0,0
1j648yo,Who am I?,"Can someone explain my situation?
I don't know who I am. Am I from this country? I don't feel like I belong.
I don't feel like a woman or a man. Sometimes I feel like a child, sometimes a man, sometimes a teenage girl, sometimes a mother, sometimes a woman.
I don't know, but I feel frighteningly different from my family and the traditions of my country.
Even the religion of my countryI'm not fully convinced by it.
Am I religious or not?
Why do I always drift off and listen to songs in different languages but never in my native tongue?
Why do I always feel like I'm living in a parallel world? Why don't I feel like I belong to this earth?
Why am I always alone, and why do I love escaping reality?
As I write this, I remember my childhood. At first, I pity that little girl, but in the end, I don't want to sympathize with this womannot because I'm not proud of myself, but because why am I not brave enough to discover who I am?
Why do I feel like my personality isn't real?
Is it because of my environment, society, or because I don't belong to this country and this religion?
Who am I?",TrueOffMyChest,2025-03-08 00:04:59 UTC,0,0,0.33,,,0,0
1j63zlg,Too rich to qualify for assistance. Too poor to pay the medical debt I need assistance for.,"Sometimes I wish I could literally die in an accident so that the calls from collections and bills piling up on my mailbox stopped. Sure, I make $80K, but it means jack shit when I live in a somewhat expensive city and a huge chunk of my income goes towards these bills.
Recently I started to have health problems, which are making me attend therapies to manage said problems twice a week. I'm spending an average of $600-$700 a month. I ended up in the emergency department last month too, which means I have to pay $4,000 to them.
Everywhere I go for assistance turns me away because I don't make less than $60K, yet these braindead morons working there don't understand the concept of my income going towards these bills, leaving me with less money to even feed myself. I'm down to 1 meal a day and honestly I can manage it because I have an eating disorder, but I just feel bad for others that genuinely can't do it.",TrueOffMyChest,2025-03-07 23:52:38 UTC,3,0,1.0,,,0,0
1j63n2g,"I might have cancer again, and I'm not telling anyone but my doctor.","I had melanoma cancer in 2023 and I'm starting to notice some of the same symptoms. I'm making a doctors appointment to get it checked out but if it's positive again I'm not telling my family or friends. I've always been the rock so when I couldn't be everything fell apart, I've had to put so much energy in time in repairing my life because I tried to depend on my village and they let me down on every account. I would rather go through the worst experience of my life again alone then go through the disappointment they put me through again.",TrueOffMyChest,2025-03-07 23:35:55 UTC,1,1,0.57,,,0,0
1j63j0w,UPDATE: My gf beat the shit out of someone who broke into her house,"I don't know if anyone remembers me but a while ago my girlfriend and I had a home invasion incident that culminated in her beating the shit out of the intruder. I'm tired of saying my gf so I'm going to call her Diana.
Turns out the guy was a drug addict from the next town over. He was in his 60s and he had an extensive history in jail and mental hospitals. Unfortunately about two months after my post, he passed away. We didn't know anything about why until we got a chance to talk to his sister, who insisted she didn't blame Diana and that the doctors even said that he probably didn't have much longer anyway. (Diana was visibly distressed during this conversation so I'm not sure whether or not the sister just said that to comfort her)
After that Diana went on a trip to a national park during a week she knew I couldn't take off and forgot her meds. She has seizures that look like mild psychosis/magical thinking and ended up refusing to come home at the end of the trip. She kept saying that she felt like she couldn't leave the woods because she was certain there was something she needed to learn there that she hadn't yet, and when I asked her how long that might take, she said ""some people take a lifetime."" I asked if she was breaking up with me, and she said something about feeling like she was ""too attached"" to me, her house, her pets, etc and that she needed to meditate on that for a while.
I ended up going to her temple to see if anyone was willing to give me some perspective on the situation since she was seeing things through a Buddhist lens. It was the right choice. A monk actually drove the six hours out to her with me to talk to her in person since she wasn't picking up calls. I am so, so unbelievably grateful for that monk because Diana started taking her meds again and came home soon after. I've never been religious but I started to read the Pali canon afterwards and that shit slaps. Diana was already volunteering her time at the temple so now we both go together when we can.
All things considered, since then, things are back to normal and going well. We're both children of divorce so even before all this we were doing prophylactic couples counseling every few months, and for a while after we were going once a week. Diana has started seeing a therapist on her own as well which I am so proud of her for since she's always hated the idea of individual therapy.
We also stepped up our home security game. Diana already had plenty of cameras, but now we have door/window alarms and motion sensors. I also convinced Diana to get another dog, so now we have a 75lb puppy
I know a lot of people were rooting for us to get married, but that's not going to happen. Legal marriage isn't something that interests us and it never has. But we did buy each other rings, and it's been a great comfort to have something physical to remind me of her on my person all the time. We're also considering having a small commitment ceremony next fall <3
Thanks again for all the feedback on my previous post. I got a lot of great advice, and some good criticism. I showed it to Diana and she got a kick out of the comments, and we had a little mutual cry over how kind a lot of you guys were. I asked her if she was okay with me posting this update, and she clucked at me and told me to do whatever I want online as long as I'm being nice (and anonymous lol). So hope this qualifies!",TrueOffMyChest,2025-03-07 23:30:31 UTC,2524,62,0.97,,,0,0
1j63eh6,I feel stuck in this life of disappointment,"damn i will definitely be embarassed about this in the future but anyways
i've always been a sensitive person, i always cared about others and made sure to make them feel good and happy. My middle school years weren't the best: i had to move out of my old house and i completely changed life by moving to a town 50 minutes far from my previous residence. You can imagine that I, an introverted and nerdy kid, wasn't able to make many friends, and so i got lonely. In fact i was known as the lonely kid, no one ever wanted to talk to me and sometimes even made fun of me (i discovered some years later that everyone talked behind my back during those years, and that was the reason no one even wanted to approach me). And so i spent three years of my life by myself: i spent my days alone, definitely years that i wouldn't want to live again. Once middle school ended, i was full of hope: that same summer i made some friends and had a lot of fun with them, and so i was positive about starting high school. And so, once my first year of school started i tried to me more extroverted and social (the outcome was awkard, i'm not good at being extroverted). Even tho i tried, the outcome wasn't positive. This time no one talked behind my back, but i had trouble making friends and so i became the lonely kid once again. I was depressed, spent my days listening to music and sleeping all day just to escape that feeling of void that was suffocating, swallowing me whole. I was ready to end it all, but i wasn't brave enough to even try, so i kept living my life and eventually things got better. I made new friends, i became more social and felt truly happy after years of suffering. I am happy about how i lived the rest of my teenage years, but that feeling never got away. I am now left with an overthinking mindset (idk if i can call it like that), which leads me to anxiety about all the friendships that i currently live: i can't be calm, because i sometimes think that everyone will sooner or later go against me and make me live the hell i went through one more time. I can't trust anyone, and this thing is making me mad, because come on, why am i so defensive? why can't i just live my life like the others, and not worry about this? i don't truly know why i wrote this, probably to feel better or to relate to someone here who perhaps lived my same experience. Anyways, i feel costantly feel this overwhelming sense of entrapment in my own life, i feel like my past will always follow me, no matter what i do. No matter how many new people i will meet, i will always have this anxiety that they will disappoint me, and life is so hard this way. I don't even know if someone will read this, i will probably only get some upvotes and my post will be forgotten in this sub",TrueOffMyChest,2025-03-07 23:24:33 UTC,2,1,0.63,,,0,0
