Post ID,Title,Content,Votes,Comments
"t3_1j5ez5s","I treated my for a broken hand/wrist as a kid and didnt know/realize it until i was older (very long read oof)","i honestly really should probably talk abt this bc it honestly was actually pretty tramuatizing, enough that i feel like i may have locked away some memories of what happened bc of just how awful some of the experience was

my memory is somewhat spotty bc of how scary it all was but ill try my best to explain

my friend had a Halloween party at her house

we decided to play something that involved running, which was a rather stupid decision as everything was slippery and dark outside

i was running near/on ground that was steeply raised up a bit for a buliding to be bulit flat on

i slipped and fell, despite the mud, when i instinctively reached out to brace myself by putting my hand out towards the top of the small slope i got hurt, really really badly, i had never been in such pain before, i dont remember how quickly it arrived exactly but it was pretty quick to show up

i started crying a soon as the pain hit and the girl i had been running behind took notice and from what i can remember asked if i was ok, the other girls i was playing with eventually noticed and the escorted me to the house and to my friend's mother who is a vet/vet tech

she wrapped it in blue vet wrap in the kitchen and asked if i wanted to go to the doctor, and child me refused out if fear of possibly having to get surgery and probably bc i didn't want to inconvenience anyone, the vet wrap was uncomfortable and irritating but honestly the splint i got for a broken foot abt 2 years ago was worse, and it was by an er doc too, and while child me had to experience that awful splint, the vet wrap did make my hand feel better, i felt like i could pick it up and move it safely

so i ended up staying inside sitting on one of their couches in the living room and resting my arm on the arm supports, watching tv with my friend's mom, i wasnt rly interested in the show but that was the least of my worries then, i think at one point she brought me food, like a hotdog or smth, which had ketchup bc my autistic ass wouldn't eat meat unless ot had ketchup on it

the other girls went outside after everything calmed down somewhat, tho my friend stayed a bit longer from what remember to make sure i was ok

eventually they came back inside for an event i forget if it was planned or started bc it was dark and I was stuck inside

basically it was a game where someone would get wrapped on toilet paper to become a mummy, they included me in it by loosely wrapping parts of my arm/hand that i was willing to move

and then we eventually all went home, i dunno when any of this next stuff happens exactly but ill try to explain it in order

i was cyberschooled then and at first i was fine... until i needed to write something, im right handed and my right hand was the one that was injured

i remember my mom yelling at me because i refused to use my right hand and i think i asked if she could write for me, she told me to use it and i remember crying and saying ""I cant! I cant!"" i tried to move it even slightly in order to try obeying what she said but the pain was terrible, horrendous, unbearable, i cant think of words that can extensively describe how much pain i was in

i dont quite remember it all but i think when i tried to use my left hand to write i was yelled at too, and my mom minimized my pain by saying smth along the lines of ""it isnt that bad"" and i was also condescendingly asked if i wanted to go the doctor which i again refused fearing surgery and also bc having my parents yell at me made me upset

all this time i remember i still had that blue vet wrap on, my hand was shaking and in so much pain, i forget if my mom did the usual ""let me feel it"" thing but if she did i most definitely refused and probably yanked it away, based on the fact I still had that vet wrap on i think it was probably the next day

i was allowed to write with my left hand but not without being scolded, i remember writing down things in notebooks for fun with my left hand, and i even decided that a character id made had my left hand's handwriting, i eventually got better writing with my left hand and honestly really had fun with it

while i wrote and did things with my left hand i also did not use my right hand or bend my wrist, at least i did as little as possible, i kept on using the vet wrap to stablize it until it wouldn't stick no more, then i found some wrap i has gotten from when i sprained my leg and so i it instead, and remembered how i treated my sprained leg, used that was refrence for resting my hand and also didn't move it bc it was painful

i dont remember much else abt the recovery, i think i stopped wrapping it and started using my right hand again as soon as the pain lessoned, which probably was after like a month or two perhaps? ik it takes longer for a broken bone to recover but the pain does go away pretty quickly honestly, i remember my mom expecting me to recover from my ""sprain"" in about a week and was upset i still refused to use it and instead write with my left hand

i did keep on writing with my left hand sometimes for awhile after that just for fun, which ironically probably helped my right hand recover lol

i dont quite know how long after it was but i think it was a decent chunk after but within the same year, i once again slipped and fell and i forget which handi landed on but based on the pain and how caught myself (the same way again) i think it was my right, which i once again assumed was a sprain, but only a minor one, so i again pulled out the wrap i had and i think for abt a day or 3 days wrapped my hand, i remember not having much pain and wondering if it still needed wrapped the next day, but i still ended up keeping it on i think

and until i was a teen it never hit me that the pain i feltin my bones was not a normal sprain thing but probably a broken bone, and it really hit me after a horse broke my foot 2 years ago that yea, that probably wasnt a sprain... bc like it was while less pain, that pain i got from my broken foot felt literally like a lesser version of the pain i felt in my hand when i was a kid

tbh im not completely sure if i did break my hand as ive never rly had it inspected for past breaks, unlike my foot it doesn't rly act up when the weather changes or from overuse etc, at least i think so? i never rly took notice of anything like thay as a kid because i was never aware or looking for anybpain related to broken bones, so im open to anyone suggesting its something else, not for legitimate medical advice as well, ik i shouldnt get it from here and its already healed, just out of curiosity, i wonder if it was like a pinched nerve maybe, but it didnt feel like one at all (ive unfortunately had and continue of have pinched nerves in my neck 🙃)","2","0"
"t3_1j5o8uu","I broke up with my girlfriend of almost four years and I regret it","It's almost been a year, and I made a mistake.In June I broke up with my girlfriend of almost four years because we were going away for college and we were both going out of state on opposite  sides of the country. I thought it would be the best thing for us, but it's been the opposite.

I really hurt her when we broke up. The first few days I thought this was going to be the best thing for me, and I just tried to push her out of my mind as much as I could, but I just kept feeling like an asshole. She loved me so much, and I took it for granted. She would do things for me all the time just because and never expect anything in return. She would constantly put me ahead of her and also just loved me no matter what I was going through.

I couldn't stop thinking about her, and during my first week of college, I was so excited about what was going on in my life, and I wanted nothing more than to just text her and let her know what was going on.

It bothered me that in the almost 3 months we had been broken up at that point, she never once reached out to me. I wanted to know how college was going for her; I wanted to know how she was doing. How could the girl who I once had this amazing love with not try to reach out to me once? I texted her, letting her know that I had been thinking about her and that I hoped she was doing well. She kept things super brief and said she hoped I was doing well, but I wanted to talk to her so much more, so I poked about what she had been doing, and in two months she had done so much, and she was going to this great huge school and was doing all of this without me.

I know I should've been happy for her, but it just made me sad and angry. We didn't talk for a month after that until she sent me a picture of a tattoo she had gotten. I was so excited that she finally reached out to me. This was the first time since we had broken up that she initiated the conversation.

We talked for a little bit, and it felt so great. We fell back into conversation like back when we were dating. It felt so good to talk to her again, but at the same time, it made me feel sick that I knew so little about what was going on in her life now, and I was only hearing so little about it. I sent her a text telling her how happy I was for her and how what she's doing seems like such a great experience for her, and she never responded. That hurt a lot.

I looked at her TikTok and Instagram for the first time in months, and I just wanted to throw up. She is living this whole life without me. She looks happy and, most of all, beautiful. Like, how dare she be so beautiful and smile at people with smiles that were once mine?  I would go to her Spotify, and I would be so paranoid that one of those playlists was dedicated to someone that wasn't me.

I felt so selfish and angry and mad at the world and at myself. I had to push her out of my mind, so I started seeing someone. I wasn't even really interested in them. Looks-wise, they were nothing compared to my ex-girlfriend. Their personality was so dull and boring compared to my ex, and in the end, I ended up just feeling like this huge dick for stringing someone along for months just to get over my ex-girlfriend.

I went home for my Christmas break from my college, and it got even worse. Knowing that we were in the same town and just a drive away from each other's houses made me feel insane. I got so nervous that I was going to run into her any time I left the house. I thought about going Christmas shopping in the mall she worked at so I could ""accidentally run into her"" and then would just get sad because I was becoming this huge creep. I wanted to text her every day asking if she wanted to get coffee, and I never did because nothing would hurt more than knowing she didn't want to see me. I texted her Merry Christmas, and she was nice about it, but she didn't want to talk to me anymore after that.

And then I saw she went back to her college before me, and it was painful seeing her with all her friends having so much fun and having so much fun without me. Seeing her cozied up with a girl on her Instagram makes me feel like I'm going to throw up. I see them post together all the time, and I just want to know if they're dating. How could she date someone so soon after 3, almost 4 years? How could she be so brazen and post her and that girl getting coffee and going on dates together? Does she not think I'll see it? I think I would feel worse if it was a man. The thought of some man looking at her the way I used to and touching her and being intimate with her makes me angry and sad and violent all at the same time.

I would stalk her pages all day while I was still in our hometown, waiting for her to post something and getting nervous when she would. How could she be having so much fun and be so happy all without me?  We were each other's first love, first kiss, first everything. And now I don't know if she's doing that with other people.

Things got a little bit better when I went back for my second semester of college, but I still just can't get her out of my mind. I'm starting to see another girl now to try and get over my ex, and she's, again, nothing like my ex-girlfriend, and I don't think there will ever be anyone like her.When I first broke up with her, I didn't think it would hurt this much. I guess in the back of my mind I thought she would've fought for us. I thought she would've texted me more when we were broken up; I thought she and I honestly would've gotten back together at this point. I'm so insanely in love with her still, and I brought this on myself, but I thought I was doing what's best for the both of us. I guess I didn't appreciate or realize the things that she did for me while we were together.","0","16"
"t3_1j5i0en","I really don’t see any point in living past eighteen","Life is so expensive nowadays, and it feels like no matter how hard I try, I will never be able to afford the kind of life I want. Moving out seems like an impossible goal, and even if I manage to get my own place, I worry that I will still be struggling just to make ends meet. When I think about the future, all I can picture is an endless cycle of stress, waking up, going to work, barely making enough to feed myself, coming home exhausted, and then doing it all over again the next day. It feels like I will be stuck in survival mode with no time or money to actually live.

I want more than that. I want to travel, to see the world, to experience things beyond the daily grind, but I cannot afford to. I am happy right now, but I know childhood does not last forever, and that terrifies me. What happens when it is gone? What happens when I am on my own, facing a future that feels like nothing but work and struggle? I do not want to live just to survive. I want to spend the one life I have being truly happy right up until the moment it ends, but right now I cannot see a future where that is possible.

I think I might just join the military so I can feel something, and if that goes well, I could get free college. But I don’t know, everything about the future seems so unappealing.

Why am I a rainbow Child and why did the condom have to break, I don’t want to be here.","1","2"
"t3_1j5l06a","I pissed myself in a ride thanks to an obese couple at a park","I hate roller coasters after this horrible experience.

My brother (17) and I (13)  were in line waiting for the Jurassic park ride(can’t remember where), the line was long and then the person in charge started asking for 2 people and no one moved. We were so tired of waiting and I told (lets call him Mateo) mateo to volunteer us.

He was reluctant cause no one had spoken up and we couldn’t see the cart, but I told him to please accept cause I was tired. When he raised his hand I saw a lot of people turn to us with a mocking expression, I started to get scared.

In our cart there were two morbidly obese people who shouldn’t have been allowed. The security lady came to secure us (it was a long bar that gets pulled from up and secures all the people in the cart from the hip idk how to explain) and she started pulling down the bar when she reached the gigantic stomach of the man. She tried going lower but his belly wouldn’t let her.

I was scared cause i wasnt secured at all. Mind you i was a fucking lanky teenager and the ride started and i felt myself slipping down. I started crying saying to mateo that i was gonna die and he realized what was happening. He tried to grab me as best as he could cause he also wasn’t really secured but he was way bigger than me. I was crying so hard trying to hold on with all my strength (it wasnt much lmao) my brother trying to help me, when suddenly i felt myself go up and almost over the security bar.

I don’t know how but mateo found the strength to pull me back down and I was panicking so hard. The ride ended and i couldn’t calm down, mateo picked me up and carried me all the way back to our parents, only then did we both realize i peed myself at 13 years old.

It was so scared, so embarrassed, top 5 worse  experiences of my life would not recommend. Being in a park with roller coasters rn made me remember that horrible feeling.

Edit: my bad at the title i meant peed, english is not first language","0","4"
"t3_1j4owse","I accidentally brought an explosive through TSA and got away with it.","The title sounds crazy but in 2023 I was visiting family out of state during the 4th of July.  At the party that I went to with my cousins we were obviously setting off large fireworks, we ended up not using all of the fireworks and later that week while hanging out with the friend that hosted the party, he gave me the firework as a joke I guess and I just put it in my backpack that I had with me (note the firework work is the type you put in a mortar so IT IS NOT SMALL.)  I completely forgot about the firework in my bag so when I was packing to fly back home I wasn’t looking for anything in my backpack and was just throwing my clothes in. Turns out I never took the firework out, covered it with all my clothes and brought it with me to the airport. I went through tsa the whole airport and my flight without knowing I had this firework in my bag. I hadn’t realized that I even had it till I got home and was unpacking and it fell out of my bag.  Funny thing is my aunt got stopped in tsa on a separate flight from mine because there was some kind of flammable residue on her stroller that was detected and she had to be patted down and all her stuff looked through but they couldn’t detect a fucking big ass firework at the bottom of my backpack.","101","23"
"t3_1j5hng3","Weird dynamic with my Ex","Ok! I’ve just gotta get this off my chest…I am still pretty good friends with my ex as we have know each other since 8th grade and we are on good standing. See the problem is that when we broke up it was because he was making some choices that were really not great for our relationship. So, I have gone on several dates as a now single woman after 4 years of dating him and I feel guilty. Like I feel like even though I am single and I have broken up with him it feels like I’m cheating or lying by omission because I have gone on dates and made out with other guys. Like I still care for my ex but unless he can work out his problems I just can’t see a future with him romantically which sucks. I feel like me trying to sort out my feelings and date for fun would crush him if he found out I’ve kissed other men as I had only had one other partner before him. Ugh it’s been eating me alive anyways I just had to get that out to the world and not keep it inside anymore.","1","1"
"t3_1j59a9z","friend is dying of cancer, can't tell almost anyone about it","It was only a couple of months between his first doctors visit and finding out it was terminal. all of this has moved incredibly fast, and I don't feel capable of talking about it much. In the few times I have mentioned it to other people, I'm always very calm. I'm very calm when I see him, too. I just can't seem to cry about it when you'd expect me to, but then I break down at random times.

He's a lot older than me, so if I ever thought about it, I probably would've guessed he'd die before me. But not like this. Not this soon.

I'm not family or anything, or a really close friend. there are people who have known him for more than a decade, and I have to be some kind of blip in his life, having only really been his friend for a few years. In a way, it doesn't seem like I have any right to be upset about this. Not when he's got actual family and friends who are as close as family. but here we are.

the thing is, like, my own parents are...fine, but fell short in a lot of ways. i'd never, ever admit this to anyone i know, but I did/do see him as kinda a parental figure. Or, at the very least, a trusted older adult. Someone I could be honest with and rely on, which is pretty rare in my life. He looked after me a bit. Now I'm trying to look after him. I don't think I'm doing a very good job of it, but I'm doing my best to do as much as he'll let me.

I feel so worn thin. I'm trying so hard to be here for him, and also be here for my best friend who's going through a rough time mentally, and my family, and also work and have my own life and not go absolutely fucking insane. i don't know. this is more important than anything else i could do. I'm just so tired and sad and i'm not sure i deserve to be but there it is. I want to tell him that he's important to me, that this is really fucking me up, but i have no idea where to find the words. I don't know that the right words exist. I'd give anything to fix this. If I could die instead, I would, but that's not how cancer works. I don't know. I'm tired and right now I just desperately want things to be okay, or to not have to be the strong one for once, but who else is gonna be?","4","0"
"t3_1j4k76n","My lesbian coworker has given me hope for the world","and myself, I guess.

Backstory, about five years ago, the woman that was my soulmate and best friend called off the engagement. It hurt, and sudden. Within two years she was dead. She'd been diagnosed with terminal cancer, didn't tell me and left because she didn't want me to deal with that, I found out from mutual friends years later after the funeral.

It hurt, confusing and I got real cynical about life. Relationships. All that. It was bad for a while, but I worked thru it.

Since then I've been mostly single. Sort of a loner. Dated,  nothing serious. Closed myself off, from friends too. Life moves forward. Career takes off. My job requires a lot of moving.

Enter my lesbian friend, who is honestly funny and so good hearted that it's made the craziness of the world bearable. I'm a male. We became quick friends both being new and looking for things to do.

She's refilled my faith in humanity. She's got hobbies, independent ideas and cares about people she doesn't know. She has sympathy for people that hate her. She's willing to be the butt of the joke and then dish it out.

I want to make clear that this isn't about a secret love or desire to date her to get over my ex fiancé. She's just a good person and friend. I just like her. She's helped me realize how much I've shut myself off from the world.

And she's reminded me of why it's so important to have connections and friends.

She's a bit of an introvert, and I'm too so we've been helping each other with that. Feels good, which I need in the world today.

She has a girl she's trying to get the courage to ask out. I'm trying to convince her to do it, like my friends did with my ex-fiancé a long time ago. She deserves a shot at happiness.

But I wouldn't have thought that for myself six months ago. This excellent lesbian friend has helped me rediscover the part of me that loves human connection. And it means so much.

Since our friendship started, I feel the first genuine desire in years to try snd do things and date. To make friends and connect with others. To be part of the world, deeply and meaningfully.

I'm so thankful to her for being just such an awesome friend, by just being herself, she's helped me in so many ways she'll never know.

I think my ex-fiancé would've liked her a lot.

And I hope all of you will have the chance to have a really great lesbian friend who will help give you faith in humanity too.

We need that.","194","16"
"t3_1j52x4u","I found out I am dating my cousin","Hi everyone, I really need some advice cause this is insane, I live in a fairly small country and recently I began dating someone (like it's been 7 months) we get along great and everything is fine, i was out shopping with my mom today and she pointed out someone to me and told me they're my cousin. I'm literally speechless, the person she pointed out is literally the brother of the individual I'm dating, I tried asking how we are related and I doubt it's a close relative, most likely distant and they are not directly related to me. None the less I feel sick and I'm just really uncomfortable, I plan to speak to them about it tonight cause I'm thinking of ending things, I don't think i can continue dating them and I'm glad i found out relatively early on.

I'm confused about how i should feel i know it's not my fault because I didnt know but it still makes me feel disgusted.

I need advice on how to cope with this.

** EDIT: please read the comments before answering, for those of you who want to know, I'm not going to be with this person in any way, shape or form, I was not in a relationship with them we were just going on dates and that. I'm not interested in being with any one remotely related to me.","8","32"
