Post ID,Title,Content,Votes,Comments
"t3_1j5l5t1","My Mom hates me","Sorry for the bad writing, i attempted to post it in an german subreddit first but they ave a limit of 3k letters max and also don't allow blocktext wich is what this would have turned into if i tried to stay within said margin (plus deleting a paragraph) So i had to use Google translate! Sorry!

I (25f) always have disputes with my (59f) mother.

Whenever I don't do something the same as she wants, she gets pretty acidic and even if I do it the same way as she wants, she somehow always has something to complain about.

Example of today:

Because of the beautiful weather, I should hang my duvet out of my window, but the problem is that the winter garden roof is right in front of my window and I can't hang it out because it is a more or less flat level. So I decided to hang the blanket over the edge of the winter garden roof, mind you at one point that was quite clean (in my opinion) at least)

And if I had hung the blanket directly out of the window, she would have been dirty or even dirty anyway.

I also had planned (and also discussed with my mother) that I would wash the blanket this weekend anyway.

Nevertheless, she then sniffed me about half an hour later and she also found it very shit that I sucked at the same time as I was sucking.

We have a solar system that produces a very nice amount of electricity in very sunny weather and I thought that it would already be finished with sucking because I hadn't heard her vacuum cleaner anymore and then started sucking my room.

However, she still has a problem with it because she apparently continued to suck again after a moment (which I couldn't hear because of my loud sucker) and also ran the washing machine (which I didn't know anything about because I couldn't see or hear her from my room on the first floor and that I was not explicitly told that it would be hired)

In addition, she also complained because I took a break when sucking (I have a cold and don't have enough endurance to create everything at once)

(My room consists of two adjacent rooms of which I usually only do one because I am more in this, but this time I wanted to do both and only took a break in between)

After I had explained Mama that, she told me that I always had an excuse.

I then started crying (no idea why, sometimes happens during such confrontations) and Mama asked in a rather aggressive tone why I would cry now even though there is no reason for it and that we would only have a reasonable discussion.

(Incidentally, the howling is nothing that I have an influence, I don't because it is to cry afterwards or something, I have zero control about whether or when this happens)

In the surplus, she also titled such moments as ""psycho shit"" and attempted manipulation.

(Not today, but in other similar situation)

Incidentally, she mostly teemers my attempts to explain and or counter arguments or ignores them entirely.

I often have the feeling of being shouted at in these moments, even though she only ""talks to me very quietly"" (her words)

I don't even want to do something in the household anymore because it is almost always wrong or not right.

And almost every interaction with her consists that she tells me something what to do, or indicate that something is wrong/dirty or somehow not correct.

That would be okay, but everything is just too much, I don't want to come down to her or talk to her.

When I come home and your car is not there, I'm already relieved.

Is probably not your fault, I'm probably just over -sensitive or overreact or something.

Also, i haven't stopped crying the whole time while writing/translating this and my mom came in and asked me in a really passive aggressive tone what was up and why i am still crying. I told her to leave and she left.

Idk what to do..

I feel like she truly hates me and idk why she does all of this like that. Maybe it makes her happy? When asked she always says that she doesn't, but Idk if i can believe that","1","1"
"t3_1j4yx7b","The cp case against my ex husband has been closed and I don’t know how to feel about it","In the beginning of the year, my (27f) ex husband (27m) came to me after not talking for a year since the divorce finalized, to confess to me of having sexual fantasies about children and looking at cp while we were together. I took this information to the police and have been working with an investigator since then, and made a controlled call to him with the investigator where he confessed only to looking at animated cp because “the real stuff is really hard to find”. Today I was told that they spoke with him and looked at his devices and haven’t found any evidence and are closing the case. And it’s a relief that, to the best of my knowledge, he didn’t hurt any children or consume any content that hurt actual children. But I was also warming up to the idea that he would face some kind of consequences for his actions. Because he also emotionally manipulated and raped me throughout our entire marriage. I know that I could still try to press charges for what he did to me, but I don’t really have any proof except for my own words. And I want to be able to just move on and enjoy my life now that I’m free from him. But he has a new girlfriend who is significantly younger and reminds me of me when I was young and fell for his bullshit. It feels so wrong that he can just do all of this and put me through so much and have nothing happen.

I hope he’s telling the truth about getting help and wanting to change, but I also can’t help but believe that every word that comes out of his mouth is a lie, even when he believes it’s the truth. But I’ve done what I can, it can’t be my responsibility anymore.","32","10"
"t3_1j5kuga","Feeling of solitude","Hi everyone, does anyone resonate or seems familiar to this? ( It's and italian text, so sorry in advance)

Una quercia centenaria, che persiste passivamente al tempo, sostenuta dal gentil suolo che l'accoglie, offre sempre il suo supporto ad un uomo mediocre che sempre ha cercato la pace all'interno di una vita in cui è facile entrare e pressoché impossibile uscire, cullato dal gentil dire delle moire, senza mostrare obiezione. La quercia offre segretamente conforto ai suoi numerosi coinquilini che la abitano ed ignora coloro che le crescono affianco e che cercano di non interferire con la sua quiete.

Le radici che prima estraevano solo preoccupazioni dai propri simili ora ricavano solo nettare puro e paradisiaco, ricco dei più naturali ed immediati piaceri: la pace del canto degli uccelli, la tranquillità di un bosco che come unica imposizione segue le stagioni con le bellezze che ognuna di essa gli porta, il rintocco lontano di una campana di qualche paese vicino. Le preoccupazioni inutili lasciano spazio solo a presa di coscienza ed accettazione.

Guardare al bosco e avere nostalgia di paesaggi passati che solo la quercia ha avuto capacità di comprendere. Voltare le spalle alla città che invece di nutrirsi di ricordi campagnoli e pensieri ciclici, senza neccessità di crearne frettolosamente di nuovi, si alimenta con la scomodità ed il rumore del futuro obbligo non naturale, non favorendo una vita vissuta unicamente sul filare dei pensieri e l'evoluzione dell'umore.

Vivere senza un'obbiettivo od un peso sulle spalle, vivere essendo nessuno, vivere solo di artifici umani e fenomeni naturali, solo la salute conta, null'altro, tutto ciò di cui ho sempre vissuto e tutto ciò che ho conosciuto: natura, relax, ricordi, solitudine ed isolamento. Così come fa la stessa quercia che ho sempre ammirato, vivrò questa vita spoglia e silenziosa, senza più incappare in tumulti di pianto ed ansia paralizzante, accettando il vento che tra gli spazzi vuoti ed isolati soffia e che ricorda all'animo la dimenticata arte dell'accettare ciò che razionalmente odiamo ma che inconsciamente amiamo, la pigrizia. L'esistenza terrena è di per sé mortale, quindi perchè rincorrere la fatica e l'ansia quando si può semplicemente accettare l'inerzia?","1","0"
"t3_1j5kpxw","I feel such deep gratitude towards someone and can’t share it","When I was 17(F), I met someone. A woman. Online. I never met her in real life, even years later. We only spoke on the phone once for an hour (years later). It was basically a purely texting relationship.

It was a blogging site, one of those where you just wrote an online diary, basically. We hit it off as conversation partners, but it wasn’t more than that for around a year. We didn’t even talk that often, but when we did it was magical. She was much older than me, and I knew it from the beginning. She was 31 when we met. It was weird for me to talk to someone older, but it just worked, and I didn’t think about it much, so I rolled with it. We talked almost exclusively about a shared hobby.

A year later I was having a complete breakdown. It was my first major mental health breakdown. I think I was just lost in transitioning from school life to college life. I suffered alone for a year (I didn’t really have a support system), and after that, I decided to open up about it in my online diary. I didn’t know what I expected, if I expected anyone to care. But she suddenly supported me. She talked to me a lot. She said she had been through the same things, so she understood what I was feeling. And that’s how it started: she explained to me A LOT about how mental health works. When I was a teenager, I didn’t “believe in mental health”. Till it bit me in the ass: I mean, I had this major breakdown, and suddenly, my “nonexistent” mental health incapacitated me. I had severe fatigue, panic attacks, even diarrhea. So, the woman basically taught me some basic concepts, explained some basic things to me. I started to read up on therapy, psychology, we’d discuss issues.

It was also magical: she just got me. I’d never had the privilege of having anyone in my life who understood me, gave me a manual to myself. I internalized my family’s approach of ‘you’re just a lost cause hysterical little shit, and there’s nothing left to do with you but ignore you when you get difficult’. And with her, I suddenly understood that I wasn’t hysterical. That my feelings had a cause. That I could actually fulfill my needs, and there would be no breakdown. So, she taught me how to relate to myself in a healthier way, how to be on my side, always. And the best part? She never actually lectured me on anything, never made me do anything, never got mad at me for not trying anything. And she was always respectful to me despite the age difference. She never played the ‘I’m older and I know better’ card, even though she was definitely older and knew better. She just explained how things work (for her, and how she thought it worked for me, too because we’re so similar), and I could take it or leave it. She just treated me the way that I understood how to treat myself. Like, she’d do or tell me things that’d calm me down, or help me get out of despair, or a panic attack, and I made a mental note ‘oh, that’s what I need when I’m having a panic attack. Yes, this works for me when I’m overwhelmed. Ok, that’s what I’ll ask for when I need support next time’.

I think I was going through this very major and life-changing breakdown for about a year. My health was never the same after that (still isn’t, 13 years later), but I was slowly learning to live with this new version of myself. I felt more stable, but I still needed a lot of support. And she was there. I don’t think I’d be alive or (relatively) sane right now if it wasn’t for her during that first year, if it wasn’t for her guidance and gentleness. I really had no one, especially no one who understood me like she did. She’s the one who made me try therapy. Not by talking about it (she never went to therapy herself), but a couple of months after we started talking about my mental health, I was reading some posts about therapy, and understood that what I felt with her, I could find in therapy. And I got really interested in it: with her, I couldn’t ask for more or for a more stable presence. With a therapist, I could get that presence for an hour a week on a regular basis. Well, I never found that therapist with whom I had this magic. Never found anyone even remotely not hurtful, actually (I have a bad trauma from therapy by now, tried 20 therapists). The woman was really the only person in the world who got me to relax and listen to her without fighting and rejecting right away. Others would just trigger me hard, trigger a defensive response and then hurt me when I couldn’t accept what they were saying, even though I was fighting myself hard not to push them away. With her, it felt like she was going through the minefield of my psyche, knowing exactly where to go and where not to go and how to neutralize at least some of the mines without setting an explosion off. And the most awesome effect was that the neutralization usually had ripple effect: she’d make one small thing feel slightly better, and I could feel the chain reaction of things correcting themselves months later, things that were unrelated to the first conversation.

It went on for years. I mean, she wasn’t my therapist, but… We talked about our lives, hobbies, mental health. It was always the older-younger dynamics, but not in a bad patronizing way: she’d just explain things, but she never pushed. She never said that because I’m younger I don’t get to have a different opinion. Never laughed at me. Never tried to make me respect her. She didn’t need to: I’ve never respected anyone like this in my life. She doesn’t have a conventional successful life: never married, never moved out of her family’s apartment, she didn’t even work most of her thirties (for reasons I didn’t fully understand but never pushed her to share). But I respected her more than anyone who had all those. She was very smart, driven, understood things deeply, always treated people with respect, everyone, she had this quality of attracting people to her, like, she didn’t wait for anyone to start talking to her (like I did), if she saw someone she found interesting, she’d just initiate. And she treated vulnerability with care. Doesn’t matter what happened between us, doesn’t matter if I hurt her (unintentionally. I’d never do anything bad to her intentionally), doesn’t matter what was happening — she never used any one of my open wounds, never chose to set any of the mines just to hurt me back. And she could do it at any moment. She spoke my language, she knew how to put things exactly in a way that her words would have the most effect, so she could destroy me. She never ever even tried in all those years. Not even when the relationship went sour and she was annoyed with me for years. She’d snap at the small things (once she started aggressively attacking me in a discussion about Harry Potter… Not me—my thought process. That’s when I knew it wasn’t just a rough patch but truly over), but she never went for my traumas. Not even when she didn’t enjoy me anymore.

As I said, the way she treated me had a ripple effect, fixing things without her even trying. Through the years, the way she treated me, talked to me, I developed that inner compass as I call it: basically, this feeling that in my life, I’m the one who always knows best. Even if I make mistakes, I’m still the one who knows best, and I’ll course correct if I make a mistake. I don’t mean that I feel that I’m always right about everything — just in my life, in things that concern me. It was very different from what my family told me: you’re incapable of anything, you should listen to us, you don’t have a brain. That inner compass made me finally start living my life. Not what my family thought was best — what I felt like doing. And the most beautiful part of it was that these things were not what the woman wanted either. They were truly mine. I moved to another country — something I always wanted. She clearly couldn’t understand my decision, but that didn’t matter. It was mine. I started speaking another language (English) more because that’s what I always wanted, and she couldn’t understand it either. And it didn’t matter. I knew what I wanted. And a thousand choices like that that she watched me make and kept her mouth shut enough. Because of this inner compass, I feel like there will always be a part of her in me, wherever I go.

As I’ve said, the relationship went sour. With years, I understood that this dynamics of her keeping me at arm’s length (I never knew much about her, her struggles, she never let me support her) doesn’t work for me anymore. And I wanted to actually talk on the phone, actually meet her. All I could get out of her was one phone call, and after that she was always “not in a good place” for a call. I finally was brave enough to admit to myself that I wanted more of her (and that I’m an equal in this relationship and an adult, too, so I have the right to pursue it), and wanted to have a relationship. She was vague about it. And then her reaction made me not sure about it, too. At some point she did try to rely on me more, and I didn’t get it, I guess, and it hurt her immensely (and when I understood that I hurt her, it was hard to forgive myself: she was someone I NEVER wanted to hurt. Not for any reason). And then we talked about everything — the dynamics, my feelings, our wants and desires — and just like that it was over, slowly, quietly, not really too painfully (and immensely painfully for me at the same time, but, I mean, she didn’t really hurt my feelings. I was just hurting because it ended). It was 7 years after we started talking.

But I could never forget her. I’d text her sometimes, just to know how she is. Nothing too personal — just to know if she was ok. She’d get annoyed at me for that. I couldn’t really understand why… She’d say something about me “trying to be a people-pleaser and showing that I still care when I don’t”. At some point, I asked her if I should stop texting her because I clearly annoy her. She said yes. I tried. I tried for two years. And then I texted her again and said that I’m not a child anymore (I was 28 at the time), and I don’t want to live in a world where we don’t talk. We didn’t have to be best friends, but I was certain we had to talk. Sometimes. About anything. At some point. And she agreed. It was weird, and I was the one texting her mostly. And then it fizzled out.

I never talked to her about it. There was nothing left to talk about, nothing left to say. But I still think about her when something good happens in my life. When something bad happens, and I handle it like a capable adult without falling apart. When I manage to choose myself instead of caving in.

Yesterday was one of those days I couldn’t keep it in (the last one was a year ago, and she did acknowledge it, even if briefly). I texted: “Hey, it’s one of those days when I can’t help it but want to wish you the best. So, here I am, wishing you the best. You’re incredible, and I feel so lucky to happen to live on this Earth when you exist”. She read it immediately, and… left me on read. I’m not sure why. She used to tell me that she doesn’t know what to say when people tell her good things, and she used to do it with me, too. But she usually acknowledged it. Now she didn’t. Did she think I was weird for texting it? Did I make it awkward? Was it too much? I guess I’ll never know. But ChatGPT told me to try and write it in a journal, so, here I am, on this sub, trying not to bother the most magical connection of my life with my gratitude.

I’ve been in love; I have parents; siblings (well, cousins); I’ve had best friends. And this connection was everything in one: an older sibling who’s almost like a parent who’s also my best friend and with whom I’m absolutely in love. She was my first adult love: the love when you don’t just fall for someone because you think they’re perfect, but the love when the more you see the imperfections, the more you respect and love the person. You understand how difficult their life is, and respect how beautifully they’re fighting and what a strong and capable person they are despite all their limitations.

My life (and mental health) are in no way perfect. I’ve made a lot of mistakes, some of which I won’t ever be able to fully correct. But the peaceful moments that I have, the good things, the authentic parts of my life, the parts where I feel like I’m living my life and not someone else’s, I owe to her.","1","0"
"t3_1j5fjlk","I hate how I obsess over people I care about, and it’s ruining me.","Every time I get close to someone, my mind starts obsessing over them, and I absolutely hate it. This is the third time it’s happened, and I feel like it’s destroying me because, with the first two, I ended up pushing them away, and we eventually became strangers again.

Right now, I’m obsessing over a really close friend in our small friend group of three. We’ve known each other for almost three years, give or take, and we’re so close we even refer to each other as “siblings.” But recently, something changed ad I've started obsessing once again. I can’t stop thinking about them. I always want to talk, hang out, or just spend time with them. And when they spend that time with someone else, I get jealous to the point where it physically hurts and I even feel betrayed in a way.

Before you think I’m completely nuts, I know this isn’t okay. I don’t start arguments, and I never tell them how I feel because I know I don’t have the right to control who they spend time with or talk to. I would never want to make them uncomfortable or make them feel like they owe me anything. But that doesn’t stop the thoughts from eating me alive. I cannot help but wish I had them all to myself.

Sometimes, instead of hanging out, I’ll say, “I’m tired” or “I don’t feel like going out,” when in reality, I do want to spend time with them—but I just can’t handle it mentally. So instead, I drive alone late at night, trying to escape the overwhelming thoughts. I don’t want to lose yet another person because of my own obsession. I am trying my best to stop, but so far, I’ve made little to no progress.","3","1"
"t3_1j61gr1","Broke Up With Partner But The Real Reason Is His Penis Didn't Satisfy Me.","We were in an open relationship and I have several other regular sex partners of 10 years and five years. I also have hookups with others. There were some differences that caused me to end the relationship. However I am a size queen and know I need it packed to feel fuflilled.  Needless to say, it afected my satisfaction a lot! I'm really sad that I settled for someone who didn't satisfy me. I tried to approach sex life as something for us to build on. As this was a newer relationship. But I never craved him when we were apart and I would not miss him physically. This signaled an end to me! I guess size really does matter and I just needed to find out.","0","7"
"t3_1j4t7km","Money would literally solve all my problems","Essentially the title. It annoys me so much when people say ""money isn't everything/can't buy happiness"", usually said by people who have enough money.

Money would literally solve all my problems and I'm not even talking about extreme amounts like 100k plus. 15-20k would solve ALL my problems. And I'm not saying that this isn't a shitload of money. It would allow me to pay my debt my ex left me with, get the education I need to find a better job and fix the broken things in my home.

Its just crazy to think that for a billionaire this amount of money is peanuts, a blip, while it would make my life not a hell of stress and worry.

And before you come for me, I know life isn't fair and with hArD wOrk I can pull myself out of it, I'm not sitting on my butt doing nothing but I just needed to vent to the void or something.","72","30"
"t3_1j5k39v","Feeling self conscious about my body after a comment made while intimate","Hi Reddit,

I’ve been struggling with something and I’m feeling really self conscious about it. I (19 M) have always been aware that my penis is very small (well below average) and It’s something I’ve been insecure about, but I’ve tried not to let it define me. Recently something happened that made me feel way more insecure than I’ve ever felt.

I was with a girl I’ve been talking to recently and we decided to have sex but during she said “I don’t know how to say this but I can barely feel anything. I was expecting something else” The way they said it wasn’t outright mean, but it felt so dismissive and made me feel like I wasn’t enough. It really got to me and now I’m stuck thinking about it all the time.

I’ve always known I’m smaller than most guys but hearing a comment like that from someone I was intimate with really knocked my confidence. I’ve only been with 1 other girl and I was self conscious about it with her but we both had a good time for the most part. But after that comment I’m constantly worrying that I’ll never be enough for a future partner and that my size will always be a problem.

I really don’t want to let this comment affect me, but it’s hard to move on from. Thanks for reading my post and I’d love to hear from anyone with advice to help move forward and feel better about not being well endowed.","1","6"
