Post ID,Title,Content,Votes,Comments
"t3_1j5y2vu","I accidentally killed someone as a kid and I regret it every day","I have decided to make a account to admit to this one thing so none of what I admitted ruins my life this happened around 20 Years ago in the early 2000s I was still a kid around 8 or 10 when I wanted to play in the forest with my friends who were around the same age it was a very hilly forest with even some mountains one of my friends maybe 12 I think the oldest one I had said he wanted to go to the highest point that looks over a river to see the view it was getting dark so my other friends were to scared to go with so they said they were gonna leave so I went with him because I never really went to that area and was curious to see what it looked like looking back I wished I just said we should go there tommorow and left it there but I diddent wanna look like a scaredy cat infront of my older friend so I went with him it took a bit of a while and I thought it would be funny to play a prank telling him I would go pee in the forest but scare him by that time we had already arrived so I jumped out from behind a tree and yelled as loud as I could he flinched and screamed in panic and I saw him trip down the edge I panicked and ran away back home as quick as possible I stayed inside for a few days but my friends asked me one day where was our older friend and I lied and said he decided to go home after we got there and looked and I haven't seen him sense I haven't told anyone about this yet","0","13"
"t3_1j5jo2t","I just want to give up…","I’m so tired of life, my entire life I have been abused and struggling, I was finally doing better and got hit by a car causing me to lose my job. I’m stuck with a man who sexually and mentally abuses me because I can’t get a job to get away from him, I don’t have family anymore either.. I’m just so tired..","0","5"
"t3_1j5jdja","The time i feel like i need it the most i don't have anyone there for me.","The one person who was always there for me was a girl i had fallen for. She was the first one in years that made me actually feel this way about someone. She was loving caring and amazing and she would drop everything for me. If texted her she was there but today she was distant. And i know why. She told me she didn't have the same feelings and i know that and i have to be okay with that and I'm trying to. But it's really difficult to. She started talking to this new guy and I'm pretty sure they went out today because she looked so nice in the one snap i got from her. It was her going out look. And the only time she doesn't instantly respond to me is when she's out with someone like that. If it's one of her girlfriends she's normally really quick and talkitive with me still. And it sucks. It really hurts and she called today to say she had a birthday gift for me which is nice because i don't really celebrate my birthday i don't like making a day about me but it's such a kind gesture. And i could tell she was really happy in her voice. And she said she had a good day and wouldn't tell me why which means it's probably the guy. And it's not like she's hiding that fact i asked her not to tell me about him and those experiences because it made me feel bad and insecure but honestly i don't know if hurts worse not being told but it still feels bad. Anyways I'm really lonely feeling right now and just wanted a connection from someone and nobody is there to answer me it seems. All the people who i used to be able to pick up and talk to whenever whenever don't respond to me anymore and when i reach out in a time like this just to feel a small connection nobody is there. And i feel so alone and I've never felt this way. I've always been happy alone but it's so different this time and i don't like it. It's been a couple nights I've felt like this but this just feels so bad in an empty way.","1","0"
"t3_1j5mrzi","My forgetfulness costed me $500","I was supposed to return a shein order by 1PM today but I missed the deadline and now I am left with clothes that can’t fit me and a $500 bill in my credit card. $500 is a lot for me and now I am so stressed over the rest of the month(a).","0","7"
"t3_1j5jbok","found out my dad had a grindr account","I (22F) recently found this out and honestly have no one i can tell that won’t look at my dad in a weird way. I’ve always had my suspicions but i wasn’t sure what i was suspicious about. I knew he had done some pretty tame things like drink and smoke but whose dad hasn’t? In a way this more just confirmed that he has cheated. I’ve also always been a sneaky person, when i was younger i would always listen through the doors and behind walls whenever my parents would fight, just so i can know everything and see how transparent they’d actually be with me. I’ve just always been nosy. A while back I was maybe 13 or 14, me and my family decided to upgrade all of our phones. When each of us transferred all of our information to our new devices some of the applications pop up. And at 13 i was the most chronically online emo loser who grew up in the 2000-2010s era so i recognize a grindr logo when i see one. That day my dad did look a bit like he knew that i saw but he probably thought i didn’t know what it was he had on his phone. I just told myself maybe i thought i had seen that logo, and left it alone, until now. Tonight after my nightly routine i forgot my hair ties in my parents room so i decided to sneak in there while my dad was asleep, and his phone was unlocked with a chat opened. Like i said….im nosy. I didn’t see anything but i 100% knew it was grinder because i saw the logo. I did take a photo while his phone was open too , i dont know why but something was telling me to! I also wasn’t sure if this was something my mother knew of and just never said anything. Just because i feel like it’s her natural response to something like that. I love my dad, he’s still a father to me and my siblings, and he works hard. This doesn’t make me hate him but it does slightly piss me off because all i can think about is my mom and how much she doesn’t deserve her husband doing something like this.

As of right now i’m not sure what i’ll do. I just wanted to get this off my chest because i know it’ll weigh heavy on me if i don’t tell some one. I feel like if i tell my friends they might pity me just because this situation is just so weird and honestly i feel like freaky stuff like this doesn’t happen in anyone else’s family LOL.","1","0"
"t3_1j5bx5n","I have a depression room and the guilt is killing me","This is the first post I've ever made of reddit, so please be patient.

I (19) have been diagnosed with severe depression and really struggle being clean. My depression stems from trauma from my mother, being verbally, emotionally, and physically (rarely, but still) by my mother (39). My room is frankly disgusting. My bed is littered by trash, clothes, and stuffed animals, I haven't seen my floor in over a year, and every surface (nightstand, TV stand, dresser, ect) are messy and filled to the brim. I lose everything and my closet is overflowing with junk I've never used. I don't enjoy doing much except listening to music and watching cartoons.

It sucks because I want to be better. I am very clean, I shower daily and wear deodorant/cologne, but my room is a mess. I hate it, and it makes me hate myself even more than I already do. I have a therapist, but I rarely see her, and I'm scared to tell her this about me. I have a full time job and people love me, I'm very organized and happy at work. No one would ever suspect I have a terrible room. The only thing I keep clean is my pets' cage (rats). I feel so embarrassed and ashamed, I never have friends over. I want to be better so badly but I don't even know where to start.

Sorry it's long, I just am really struggling and any advice would be helpful.","4","4"
"t3_1j5fvs8","Am I being over dramatic about my dog?","I’m 15(f) and I live with my “parents”. I have this wonderful dog named Richy, he’s the best thing that ever happened to be but my parents have a rule where he can’t go inside the house, he’s an outside dog. It’s been raining a lot where I live- I’m talking like crazy winds and rain. I asked multiple times if my parents can let Richy in because he can get cold and lonely out side and the response I get every time is “no, don’t ask again” or they say I’m being dramatic about him and that he’ll be fine. To mention Richy has a little space under the balcony and in the laundry room which is right underneath the balcony but it’s still very cold there . I think the way my parents treat Richy is unfair there have been multiple occasions where Richy has gotten hurt and has been neglected, for example when he was a puppy a brick fell on his paw and he was limping for weeks and my dad refused to take him to the vet. As I’m typing this the rain is getting far worse and the wind is howling.To all the dog owners out there do you guys leave your dog out in the rain?","2","3"
"t3_1j5bn88","my uncle's girlfriend is tearing my family apart","So, I'm from a very close-init family, we love each other a lot and have always been together. My grandma had three children, uncle A, uncle B, and my dad, and then grandpa had a child with another woman, uncle C. This is about uncle B.

I don't like his current gf. She immediately trauma dumped on my grandma to gain sympathy, then proceeded to imply she was old and getting forgetful and clumsy (grandma's perfectly fine, she's as healthy as they come), then she brought along her son she had with another man, who I have no trouble with. She herself isn't bad, but the way she and her son behave is weird, because it's like they're not a part of our family, they just kinda live there, and I have the feeling that she wants to kick my grandma out and have the house to herself, which isn't possible because it's decided 50/50 between uncle A and uncle B, but she's tried to buy the other half to uncle A, who firmly refused, because once they both pass away, the house is mine.

The worst part about all this is my uncle's behavior since she arrived. He works with my mom at a local restaurant, nothing fancy, its main target are the broke college students nearby, but they get paid well. My mom had a cousin of hers working as a waiter there, and he wasn't the best, but hey, acceptable,  but uncle B decided to start saying that he was more trouble that its worth, and that his girlfriend's son should work there, my mom firmly refused. My grandma has anxiety of going out on her own for years now and since she only lives with uncle B and his girlfriend, she constantly relies on him to get medicine or to just go out, and he's been getting extremely rude with her for no reason whenever she asks to go out, yelling and saying ""he needs his own time too"". We threw a party for grandma's birthday a while ago, and you'd expect him to sit with his mother, but no, he went and sat with his gf's family, completely ignoring grandma. I fell and got hurt pretty badly a while ago, and everyone called me and asked of I was okay, but him? Not a peep.

My last straw came a few days ago, my mom suffers really bad anxiety/panic attacks sometimes and he caused her one. Long story short, he missed work without calling in advance and my mom had to cover his shift and then tried to reprehend him because she's the manager of the restaurant. He completely flipped out and said something along the lines of ""leave, it doesn't matter, (gf's name) can replace you"", and my mom got really mad, and said ""I don't want to have anything to do with you as work or as family, you're never stepping foot into my house again"".

Now I love my uncle, but his gf has completely ruined everything, I don't like her, I see her and I feel angry, but I can't do anything because I'm forced to interact with her, and you'd think my lack of warmth would tell her to not talk to me, but she talks to me as if she was my aunt, SHE'S NOT, and I genuinely wish I could just make her go away and make things go back to normal. I want my family back.","4","1"
"t3_1j5izbf","What is wrong with me?","Why do I not panic when most do or when I ""should? In fact, I thrive. I've been put in and witnessed some of the most extreme situations(because of my career and childhood) I witnessed one of my closest friends get shot recently. My reaction is what is now bothering me. I was calm. Remember every single detail. Never panicked.","1","1"
"t3_1j5iwrt","Is my bf incapable to love?","We've been together for 10 months and living together since November, splitting bills. My bf is autistic and I pretty much brush off many things to that, but I'm starting to think he has no idea what love is.

I'm 100% sure he thinks he loves me, I'm helping him a lot and we're basically the only people for each other in the whole country. It's pretty comfortable for us to live together.

But nothing besides his own thoughts and life is interesting to him. He speaks 99% of the time. He never shuts up, ever. When I talk, he interrupts me and when being called out, says he can't understand when it's the time for him to talk and when not. Sometimes he'll also tell me what I said was boring. Can you truly love a person if you don't give a shit about anything else apart from yourself and your thoughts?","1","4"
"t3_1j5d5iw","What should I do?","The past almost two weeks, I’ve felt my depression coming back. There isn’t always a reason it happens, just comes over me when it feels like it I guess. I don’t know what I like to do anymore and my energy has really been lacking also. Along with my self esteem. I am feeling really bad for my boyfriend now because of my depression and how I may be coming off. I’ve been more anxious and also not knowing what to say or not having the energy to talk as much. This is the first time my depression has started “coming out” since we’ve been together and even though I know I can talk to him and he would be 100% supportive. I don’t really know how to explain how I’m feeling so I’ve started pretending I’m okay when really I feel like I’m being held under water. I also feel like my low energy, not talking as much is making our relationship boring for him maybe? I want to see him and be with him. Even if we’re just laying together, especially if we’re just laying together cause that’s almost all the energy I feel like I have right now but I keep thinking, he didn’t sign up for this and shouldn’t have to go through me feeling and being this way. I think this is more of venting than asking for advice. I don’t want to scare him off with how much/bad my depression can get.","3","1"
"t3_1j5iuc7","Feeling hopeless - seeking guidance on funding for graduate studies","Hello everyone,

I am a Sudanese civil engineer currently residing in the UAE. I am actively seeking scholarships, assistantships, or any financial aid. I've been admitted to ASU for an MS in Civil Engineering (water quality & scarcity). Studying in the USA has been my dream, but securing funding has been extremely challenging, especially given the current situation.

I have contacted over 60 professors and applied to multiple universities, but funding remains uncertain. With the ongoing conflict in Sudan and limited opportunities, I am struggling to find a way forward.

I am afraid that even if I secure funding, I may not be granted a visa due to the war in my country.

Is it possible to study there given these circumstances, or should I give up?

If anyone has insights or advice, I would truly appreciate it.","1","0"
"t3_1j5itoh","All my friends left.","I just wanted to put this out there and hopefully someone can read it or relate, or share any advice, or whatever. i spent a very long time getting out there and getting a big group of friends, just for them all to leave, i’m okay with finding new friends, and have been looking for a long time, but the truth is,

it wouldn’t usually bother me, but I can’t help but feel so bitter and mad about it, like I can’t really shake it. I’ve been looking everywhere around me, but same for jobs, I literally can’t find any social groups near me. (Multiple websites, social media groups etc.) Like i said, I just wanted to put it out there, at the very least someone will be able to see this.","1","0"
"t3_1j5itfh","Im breaking up next weekend with my girlfriend of 2.5 years","Throwaway cos yeah personal stuff.

I (26m) plan to break up with my girlfriend (26f) next weekend. We have been together for around two and a half years and we just dont really have anything in common, our conversations are frankly boring, she is a lovely girl which is why this has been the hardest decision ive ever had to make but i think its for the best. I spoke to her a couple weeks ago about a few things that were bothering me and sex was one of them and it made me realise that it was a different level of priority for us, for me its quite high and im very much experimental in that department and would love to try things but she just doesnt. And im not going to get her to do something shes not comfortable with or doesnt want to do. We also spoke about how id like to see more effort and enthusiasm during sex from her as i felt a bit like my pleasure wasnt that important which isnt a great feeling let me tell you, and she hasnt really put any more effort into it minus the absolute bare minimum.

If im completely honest, im terrified. Im scared of what the future will be, scared that I wont find someone else, scared about hurting her which is the last thing I want to do is hurt her but I also need to take care of my own happiness. This is my first proper relationship and girlfriend, I've never had to break up with someone and im so scared.

My minds still a bit mad trying to process my decision so sorry if this doesnt read very well.

Edit: more things to get off my chest jesus sorry. I do still love her, and this yoyo effect I'm feeling of wanting to break up then doubting has made me feel so numb scared and empty I feel so lost. Each time my girlfriend messages me today it hurts so much i really do care for her but, i just don't know if I'm doing what I did early on and ignoring things that obviously do bother me because I've got complacent.","1","4"
"t3_1j53tt6","TIL that my coworker had a Title IX case against him - from my predecessor - and he's still here.","I don't really know what to make of this, and I don't really have anyone to talk to about it. I (23F) started my master's this academic year and was brought in as a graduate assistant in one of the academic advising offices on campus. Our office has a new director who comes from a high school administration background and relatively new advisors (two of them, both have been here five years max).

Until yesterday, I didn't know why the previous GA left her role. She clearly left in a hurry because my office (her office) still had wall decorations, cork boards with posters and flyers, supplies, and cabinets chock-full of folders with papers, guides, flyers - you name it, it's here. It looked like the place was already in use is what I'm getting at. She created entire binders about our department's programs and even fully stocked the supply closet that we have. I knew she hadn't left due to graduation, it had to be either right before she graduated or she hadn't renewed her contract, but I didn't know why. It's not really my business, but I was curious and wanted to be sure it wasn't for something nefarious.

So, my suspicions rise when a classmate of mine, M, recognized the office that I said I'm a GA for (a handful of us are GAs, most of them for our college, but me in this advising office) and she brought up that she used to work there in undergrad until she graduated last year. M started asking about names from when she was there, and it became apparent we've had a lot of staff changes in less than a year. I thought, ""Interesting, I wonder why?"" She also did not like most of the people (advisors/director) who are/were here. I kind of shrugged it off, figuring that she probably just had some bad experiences or that the leadership prior to our current director was suboptimal, because I liked my coworkers. Naïveté on my part, I'll admit.

But something hasn't quite left me since that day: M said the previous director, let's call him Colin, resigned after being caught in a relationship with a student. I took this with a grain of salt because I hadn't heard that, not even from the other student workers who like to gossip, and M had made it clear that she didn't enjoy the office atmosphere.

Things came to a head for me yesterday, when I met with the current director to discuss some issues with the website. Things progressed to how she doesn't like how disorganized the supply closet currently is, and her plans to clean it out with our administrative assistant over spring break. She mentioned having so much stuff left behind by the previous GA, like thick binders of who-knows-what, and not knowing what to do with them. They're multiple 5-inch binders stuffed to the brim.

Bringing up the GA snowballed until Director casually mentioned how my coworker, let's call him Andrew, one of the two advisors in our department, was the one caught making sexual advances - and toward the previous GA. They had gone out for drinks after-hours (unsure if it was with a group), and he had texted her inappropriately about hooking up. The then-director, Colin, received word of this but didn't want to do anything about it. He was promptly fired for his inaction once an actual, full-blown Title IX case opened against Andrew.

The GA left after this incident and no one has seen her since. She left everything behind. Her friends harassed the office to try and hold Colin accountable, but it wasn't until the case was opened that action was taken.

I'm in shock and just don't know how to process these instances. He came onto my predecessor, yet she left, and he is still working here. I don't even know if she's graduated, but it makes sense now why her stuff was left behind and why nobody talks about her aside from the student workers who don't know the truth.","10","3"
