Post ID,Title,Content,Votes,Comments
"t3_1j5i389","Why does not enough karma to comment exist","Why the fuck does it. How am I supposed to gain the fucking karma if I can’t fucking comment. Do you really expect me to comment on some fuckass subreddit I have no interest in just to gain karma? What the fuck1?","3","2"
"t3_1j5fbdy","Hurt","You weren’t happy with me. It felt like whatever I did would never make you happy. I hadn’t felt loved by you in a long time. You say you love me, but why didn’t you act like it? I tried to show you love and you didn’t want it. There’s only so much I can do before I can’t anymore.

You say you miss me. But you never talked to me. You hid all your feelings from me. We’d go to therapy and it felt like an attack on everything I did. It felt like anything and everything I did was wrong.

I was always the one in the wrong.

But what about the things you did that hurt me?

Yeah I’m good at compartmentalizing. I’m good at bottling up my feelings to make others comfortable. It didn’t feel like you cared that I was doing it since it gave more room for you to talk about how you were feeling.

I gave so much of myself to you.

Did you really love me?

Or did you just love the idea of me?

Someone to listen to you and ask how your days were and what? Why didn’t you do that for me? I wore myself out trying to make you happy. Happy with me. Happy with you. Happy with literally anything. I couldn’t do it.

I miss the days that we could sit and talk for hours. I miss the days that you would smile when you saw me. I miss the days that felt like you truly loved me. I miss the days that we were actually friends.

But maybe it wasn’t real. Maybe it was the attention I gave you? Or the gifts? Or maybe I was a distraction? Something shiny and new. Uncharted territory. I don’t know.

I don’t know what you’re telling people. That I broke it off? That I did this and that and whatnot? You blocked me so it’s not like I can try to support you. Not that you were accepting of my support over the last year plus. I really tried. And it felt like you just didn’t care.

I shouldn’t have looked you up on here. I noticed you blocked me days ago. You didn’t tell me where you were moving-not that it’s my business, but it really sucks being completely blocked out by someone who is saying they love me.

Loved me.

My heart hurts. And I can’t even talk to my best friend about it.

You wanna know why I’ve been talking to her? Because my world revolved around you. I stopped talking to my friends. All of my friends. Because you were my world. But I was just a bother to you. An annoyance. A burden.

I needed someone to talk to and she messaged me. She wasn’t a bad person so I don’t know where you got that from. If anything, I was the bad person in that situation. I let you be mean to her. I let you do what you wanted because I thought you were my forever. But you didn’t think I was your forever. You don’t treat your forever the way you treated me. How are you so okay with just disappearing on me?

I truly hope you can find happiness. I wasn’t the one for you and that’s okay. I hope you can show love to the next person you find. Not as a rarity, but strong and unwavering. Love them with everything you have, because you deserve love and to love.

I just wasn’t enough.

I wasn’t ever going to be enough.

I just wish you’d have told me sooner.","5","1"
"t3_1j5tjlt","My boyfriend is watching his ex and has the urge to jerk off","For some context, my boyfriend (23m) and I (24f) have been in a relationship. He was after me for 1 year, dated for 1 year, broke up, and have been dating for 6 months now. I have an autoimmune disease that is mostly affected by my mental health, and can create severe illnesses and damages to my body. Since I’ve been dating him I´ve been noticing my health getting worse and worse. To add more to the story, I found out he was attracted to his work-colleague and made some sort of move, check my other post to figure out some more about this (if interested, but it will add more to the story and will help you gain a better understanding). Plus, my boyfriend since the start of our relationship has told me how he’s a man who doesn’t watch corn, and has been flexing it to his guy friends and all.

So, my boyfriend has been recently saying non-stop how he’s open for me to check his phone, he has actually said it so much it was beginning to be suspicious. I had been noticing him becoming more irritated with me by the second without me doing nothing, and I asked him. I told him that I knew there was something he was hiding that was making him so anxious with me all the time, that's when I began suspecting, and he denied all of my comments, saying it was because he’s been so busy with work.

After some days, he started saying it again, telling me that I could check his phone whenever I didn’t trust him. He was always used to me saying no, since I was keen on not doing so since I felt like doing that. There must be a lack of trust in a relationship and that’s how they fall apart. So, he didn’t expect me to say yes this time. I did due to all my suspicions at the moment. He watched me, and didn’t dare say a word. I gave him some time to be honest with me before looking through his phone and he reassured me there was nothing. I went to his recently watched in tiktok, and I found gems there. He watched these typical girls with boobs bigger than their heads move their butts and boobs sensually. Then, there were many replays of this girl we both knew he talked to before ever getting with me. He didn’t say anything and denied ever doing anything with her videos, only getting hard and then looking for other stuff to jerk off, which I think is a complete lie, but still.

Not only did he break promises by telling and promising me that he didn’t watch corn or other girls, but also lied to me about it until I figured it out. He was never honest and I believe that he still is hiding things from me just because I didn’t figure them out yet. It was already bad that he did this, but worse when it was his ex situationship.

I need some help and opinions to clear my mind, I don’t know if I’m crazy or being rational. I would appreciate other people’s experiences dealing with wrong people and then finding a good person for you. I need to believe that this is not the love I deserve and that there’s many guys out there that won’t do this to me.","0","31"
"t3_1j5mwpv","Potentially ableist rant about ASD and Neurodivergence","I’m frustrated with how ASD dominates the majority of neurodivergent discourse. I get it. I really do. ASD is very misunderstood and it very often coexists with other ND types.

Buuuuuut… it feels like everyone only talks about or thinks about ASD. Heck, even terminology seems ASD specific.

Sometimes I just want to find something about ADHD, and I get told it’s an ASD symptom that can be present in others. Erm, no. It’s an ADHD struggle too, based on self reports from those with a diagnosis.

Why are most ND struggles seen through the lens of ASD so much?

I’m struggling to verbalise my thoughts and I’m hoping someone gets what I’m saying.

We need space for just ADHD, just dyslexia, just OCD. Co-morbidities are co-morbidities. Not the core of disorders.

I’m sick of being told that something I deal with is “ actually an autism thing,” and I just happen to experience that just by chance. No. I’m not autistic. My struggles are not autistic traits. They are ADHD traits. We’d know that if we stopped calling every trait in an ND person an autistic trait.

I’m sick of my symptoms being seen as an afterthought -  a fringe case of ASD symptoms.

Acknowledge my disorder for what it is. I’m tired of being an “oh, by the way” addition haphazardly tacked onto an ASD discussion.

Yes, it is ok to acknowledge that some things are ASD specific that I happen to do by chance. No, not every ND trait is autism specific. My sensory issues are not ASD traits, they are ADHD traits. Stop telling me “it’s okay to acknowledge that some things are ASD traits that others experience.” What are you implying?

And I’m definitely not arguing “everyone is a little ASD.” That’s stupid, and if you manage to get that out of my rant, I can’t help you.

I’m saying, validate my struggles as they are. Not because they overlap with ASD.

What’s funny is my friend who says this doesn’t pick up on the fact that it hurts me when they say these things.","1","5"
"t3_1j5hlsy","I hate myself and feels like I’ve given up without trying","I’m a 23-year-old guy (turning 24 in August), and I feel like a complete failure. Depression has been a constant in my life, and I’m pretty sure there’s something seriously wrong with me mentally. I’ve never sought professional help never in my life. Instead, I’ve coped by abusing drugs like MDMA, LSD, and and ket, weed every single day since I was 14. It’s been my crutch, but it’s not working anymore. I’ve never had a real girlfriend, though that’s not even my main issue. The real problem is I can’t stay consistent with anything working out, holding a job, nothing. Today, I was supposed to get up and go to work, but I just couldn’t be bothered. I bailed. It feels like my brain is fighting against me. I’m suicidal 24/7. When I hit these lows, they last about three months, then I get a month of “normal” before it crashes again. Right now, I’m in one of those dark phases, and it’s so bad I’m genuinely debating whether to end my life today. I don’t know what to do anymore. My body’s a mess too I go from fat to skinny and fat to skinny again, stuck in this weird in between because of how depression screws with me. I’ve felt like this my whole life, and I’m terrified it’ll never change. I’m getting older, life’s getting more harder and serious, and everything’s so damn expensive. I have no ambitions, no goals. I never went to school. I blow all my money, I’m in debt, and I live alone. I feel like a corrupt soul. I say I believe in God, but I don’t really. I’m a fake religious person, a fake human. My friends are starting to ditch me because of how I am, and I don’t blame them. I’ve had enough. I feel like death is the only way out of this hell because I can’t imagine dragging this on until I’m 28, 35, or older. It’s already unbearable. My mom’s tried to help me so many times, but she’s given up too. I always end up back at square one, no matter what. I hate myself so much. I guess I’m posting this because I’m desperate. Has anyone been here and gotten out? I don’t even know where to start.","3","1"
"t3_1j5jc5t","I’m almost 22 and I’ve never been on a date","Like the title says, I’ve never been on a date. Women have expressed interest in me + I’ve had past relationships but they were all long distance. Which means I’ve never gotten to take a woman out for dinner or coffee. Here’s the kicker tho, every time I tell someone that I’ve never been on a date, I get a variation of “no way” or “you’re lying” or “how?”.

Getting these types of reactions means that I am good looking to an extent I guess, but it hasn’t translated to any dates. I will admit tho, I am a late bloomer, I was bullied mercilessly as a child, was fat then skinny and now I’m in the middle which is nice.

I know I need to put myself out there more but every time I do so I get burned rather quickly, in spectacular fashion I may add. I’m also afraid of rejection which doesn’t help. My luck isn’t the best either, and considering how unavailable people in my city are, I guess it makes sense. I just feel so far behind my peers, I feel weird.

I get everyone has their own timeline but at the same time, when most people your age are in committed relationships or going out on dates, it’s hard not to feel unloved/unwanted in addition to feeling like you’re behind.

I also wonder if I should ever tell a woman this when (not if) the day comes? Will she be turned off? Will she be weirded out and think to herself “what’s wrong with this guy? How has he never been on a date?”

Thank you for reading and take care.","2","3"
"t3_1j5mosy","My mom might never be the same","Ok, I know the tag is bad but let me clear stuff up right off the bat. I didn't try to kill myself, nobody in my family did, and nobody in this story succeeds in doing so. With that said, it's still disturbing.

I go to a high school that is located right next to a PreK-8 school. My mom works there and teaches PreK4, while my brother attends as a 7th grader. Yesterday, my mom and brother told me of something that happened. Basically, a kid in my brother's grade tried to kill himself in the bathroom using his belt (part of the uniform) and was at it for several minutes before a friend of the kid went looking for him. To make a long story short, it was a whole 2 hours afterward that the police were called and something was done about it.

Now this alone is devastating and disturbed my mom, but what made me call my post this was this detail of the story.

The kid tried this around 11 am. The administration was only made aware at 1 pm. The kids knew this and said nothing. Now you may think that it's because he's a bully or disliked, but he was a smart kid who played football at his school and was generally well-liked. The chilling part was that most kids were just indifferent to the whole thing. They felt bad, but nobody was particularly emotional. My brother said that everybody was silent but only a few who he knew feared death. The kid who went to check on the victim got texts from the victim with suicidal thoughts, and he said nothing at first. And that's why I named this post what I did.

My mom is one of those people who believes that suicide is cowardly and that there are always options for those who feel that way, but hearing how a group of kids witnessed one of their try that and then everyone not go talk to grown-ups was shocking for her. Even worse, since they have, the school has not made anything public yet about this incident and probably is just going to sweep it under the rug. Now I might have exaggerated the title a bit, my mom is a very resilient woman. But I fear that the way this story played out will affect her for a long time.

Also normally I would talk to friends and people in school about this, but the victim's older sister attends and probably doesn't want anybody to know, so I ranted here.","0","2"
"t3_1j59o42","my friend tried to rape me, I don't know how to move on and my friends think I'm a bitch","some of you might already be familiar with my profile, with my story. I was sexually assaulted a while ago and I really thought I had it figured out. I don't. I'm not going thru all the details of that again but I posted it here a few days after it happened, you can look on my profile if you want to know.

After my last post, I went along with many of your recommendations, I took pictures of the bruises, I warned all my female friends bout his conduct, blocked him everywhere and even told my sister about it (not exaclty how it happened, just that I was feeling scared most of the time and that I was SA'd, I didn't wanted to go into detail with her).

And I thought, I really did thought, it was all going well. For the past week, I had not thought about him once, I had not cried bout it anymore, I was healing, I think. But today I overheard someone talking bout him.

Actually, I heard them talking bout me.

One of my friends - that was in the party I was SA'd at - kind of has a crush on me and everyone knows it even tho he never told me upfront. Today, I overheard some of this guy's friends saying how much of a bitch I was to be with someone else in front of him. I wasn't ""with someone else"" I was being assaulted. I was crying, I was asking him to stop.

I didn't knew he saw it. I didn't knew any of them saw it. And now I feel dirtier than ever. Yet at the same time, if they saw it why didn't they stopped it? Why didn't they helped?

I want to rip off my skin, to burn it so deep there won't be an inch left of what the man who sexually assaulted me touched. And yet now there's also this dreading feeling that they would still view me as nothing more than a bitch. I feel like I can't breath, like I can't ever run away from how tainted he made me, how dirty and broken he made me. Everytime they look at me all they see is my assault, and they think I chose that, think I am a whore. I can't deal with that. I don't know what to do.","11","4"
"t3_1j5mfrg","Revenge","I was involved with a married female for about 10 years. I was abut 25 in a new city and needed some support. I was staying at my relatives house and she was my sister in law. She was in a bad marriage and wanted to emotional support. This was my first relationship and the last. I provided here the emotional support and was like a father to her kids. One of her kid had adhd so needed the extra care. I was the emotional kind so thought this would last forever. She fed me thoughts of they being my own kids and i simply believed it. i imagined my entire life with here. even planing to shift to Canada to be able to be with her. I had to move to a different city before covid and thats when things started changing. She messaged less and called less. didn want to speak to me stating she couldnt get a chance. I Kept begging her to give me time to speak to me. Then she said something to the kids so even tey started speaking less to me. In the meanwhile my marriage got fixed and she just stopped talking me me altogether. I still wanted to be in touch with her, moreso with the kids but she took everythibg away from me. She conviniently said that she dosent thinks its right. for 10 years she felt it was ok. Its been 4 years and i still feel the anger. I feel she used me and i want to take revenge. Ohh yes my wife knows about it. Today is her 25th wedding anniversary and I want to send our old chats and some pictures to her and the family. I feel she made the kids hate me as she didnt want to answer their questions about the affair and wanted to protect her image. so I want everone to know about our realtionship and break her image of a good human.","0","1"
"t3_1j5h23j","I traded in a car. The heat wasn't working.","Its the middle of the night and I've just woken up. I feel guilty.

Yesterday I traded my car in for a new truck. The heat wasn't working in my car but the dealership never noticed. I actually went to a few dealerships and none of them noticed the issue,   which seems weird because its winter and I'm in Canada.

Sitting down with the salesman, he never asked me if there were any issues with the car and when he asked if they could check out the car I let them. I don't feel like I tried to hide the issue but I really hoped they wouldn't notice. Now that I got my wish I don't feel real great about it.","3","4"
"t3_1j5fikp","The nights are too quiet now","I didn't care how much sleep I lost each night. I never got tired of hearing her voice, or seeing how pretty she looked each time she smiled or laughed. I wonder if she knew just how beautiful she looked when she talked about something she loved. Everything with her felt new and exciting as if I was experiencing love for the first time all over again.

The nights are too quiet now. I still check my phone, knowing her name won't appear. I scroll through old messages, replaying our conversations, and wonder if she thinks of me. If she does, I hope it brings her a smile, the way those memories always do for me. And if not, that's alright too. Because I know, in that time, we shared something truly special, a spark of pure joy that I'll always cherish.

I don't know when or if I'll ever see her again, but I know this for sure: she was one of the best moments of my life. I hope she knows that she is still deeply loved and profoundly missed.","4","0"
"t3_1j59xpo","I’ll have to face the fact I have to stay in my awful, toxic job.","31F nurse in a very toxic environment.

I’ve been denied a promotion twice in 6 years.

I feel my growth has been stunted, no room for promotion, I’m not learning anything more. The staff are bullies. I’m being bullied by three seniors who are ganging up on me. Higher ups told me to be quiet basically when I reported it.

I’ve been run down, chest infection after chest infection, extreme fatigue etc then I went off sick five weeks ago after being told to shut my mouth basically and I’ve been fine since. In a good head space, no fatigue etc.

I’ve job searched every day. No suitable roles as I am specialised theatre nurse. All I keep seeing is clinical assessor/Pip roles and I’m at such a breaking point with my role that I am close to going for that one and it’s hated by people and run by private companies who can sack you at  any time.

I have to return back to an environment where the people are nasty, where the seniors are out to get me (and they are) and where I no longer feel I am learning, improving or getting anywhere. No amount of effort I put in works there anymore, and I’ve tried my hardest.

I’ve even contemplated leaving nursing entirely but no other role pays the same and I cannot afford to retrain for something.

I have a mortgage, pets to feed, bills to pay and now I have to accept the fact that i have to stay in this place for longer until I find somewhere else and even then, work never let me leave for an interview. I have to stay in my work prison and serve a never ending sentence.

The last day before I went off sick I genuinely contemplated driving my car off the bridge on the way home. Now I have to go back. My doctor said he’d give me a paper for more time off as he understands the pressures. But I don’t know what’s the best thing to do. I’m grateful I have work and have a job, I just wish it was filled with a lot nicer people where I could have a fresh start.","9","4"
"t3_1j4rccj","My grandpa used thousands of dollars out of my grandmas account and then DIED.","So recently my granfather died, He was a sweet guy as far as any of us knew him. He wasnt very active in recent years, in fact he was terribly sick for most of my (f20) life and id either see him at the hospital or on the couch barely breathing. So tell me why my grandma (whos a bit of a oversharer) told me about the family drama aka my grandpa took out thousands of dollars in cash from their bank account. My grandma found out shortly before he died when she found a bag full of cash and had their kid (my father) investigate. They planned on having a family intervention and question him on where the money has gone but then he just died! It wasnt a surprise for anyone that he died but like goddamn what could this old man use all that money for?? Like he would barely get out of bed he was so sick. I got his old car and its bittersweet, and im just so genuinely confused as to what he couldve blown all this money on and also terrified that there might be more in the car or other places. Anyway i just had to tell someone cause its driving my insane thanks random reddit user!","139","27"
